3571	11.011470	76.223.111.18	192.168.178.64	TCP	1506	443 → 59507 [ACK] Seq=1194 Ack=2769 Win=782 Len=1452 [TCP PDU reassembled in 3572]
3440	10.545877	46.228.174.117	192.168.178.64	TLSv1.2	1506	Certificate
3439	10.545877	46.228.174.117	192.168.178.64	TCP	1506	443 → 59688 [ACK] Seq=2905 Ack=2073 Win=81920 Len=1452 [TCP PDU reassembled in 3440]
3438	10.545877	46.228.174.117	192.168.178.64	TCP	1506	443 → 59688 [PSH, ACK] Seq=1453 Ack=2073 Win=81920 Len=1452 [TCP PDU reassembled in 3440]
3437	10.545877	46.228.174.117	192.168.178.64	TLSv1.2	1506	Server Hello
3335	10.140615	184.28.88.119	192.168.178.64	TCP	1506	443 → 59456 [ACK] Seq=864 Ack=3898 Win=501 Len=1452 [TCP PDU reassembled in 3336]
3316	10.128672	184.28.88.119	192.168.178.64	TCP	1506	443 → 59454 [ACK] Seq=864 Ack=3902 Win=501 Len=1452 [TCP PDU reassembled in 3317]
3133	9.190110	136.243.25.87	192.168.178.64	TLSv1.3	1506	Application Data
3132	9.190110	136.243.25.87	192.168.178.64	TLSv1.3	1506	Server Hello, Change Cipher Spec, Application Data
3127	9.187972	136.243.25.87	192.168.178.64	TLSv1.3	1506	Application Data
3126	9.187972	136.243.25.87	192.168.178.64	TLSv1.3	1506	Server Hello, Change Cipher Spec, Application Data
3115	9.158920	54.77.230.99	192.168.178.64	TCP	1506	443 → 59682 [ACK] Seq=18164 Ack=2860 Win=47872 Len=1452 [TCP PDU reassembled in 3121]
3114	9.158920	54.77.230.99	192.168.178.64	TCP	1506	443 → 59682 [ACK] Seq=16712 Ack=2860 Win=47872 Len=1452 [TCP PDU reassembled in 3121]
3113	9.158920	54.77.230.99	192.168.178.64	TCP	1506	443 → 59682 [ACK] Seq=15260 Ack=2860 Win=47872 Len=1452 [TCP PDU reassembled in 3121]
3112	9.158920	54.77.230.99	192.168.178.64	TCP	1506	443 → 59682 [ACK] Seq=13808 Ack=2860 Win=47872 Len=1452 [TCP PDU reassembled in 3121]
3108	9.127250	54.77.230.99	192.168.178.64	TCP	1506	443 → 59682 [ACK] Seq=12356 Ack=2860 Win=47872 Len=1452 [TCP PDU reassembled in 3121]
3107	9.127250	54.77.230.99	192.168.178.64	TCP	1506	443 → 59682 [ACK] Seq=10904 Ack=2860 Win=47872 Len=1452 [TCP PDU reassembled in 3121]
3106	9.127250	54.77.230.99	192.168.178.64	TCP	1506	443 → 59682 [ACK] Seq=9452 Ack=2860 Win=47872 Len=1452 [TCP PDU reassembled in 3121]
3105	9.127250	54.77.230.99	192.168.178.64	TCP	1506	443 → 59682 [ACK] Seq=8000 Ack=2860 Win=47872 Len=1452 [TCP PDU reassembled in 3121]
3102	9.125970	54.77.230.99	192.168.178.64	TCP	1506	443 → 59682 [ACK] Seq=6458 Ack=2860 Win=47872 Len=1452 [TCP PDU reassembled in 3103]
3101	9.125970	54.77.230.99	192.168.178.64	TCP	1506	443 → 59682 [ACK] Seq=5006 Ack=2860 Win=47872 Len=1452 [TCP PDU reassembled in 3103]
3085	9.075116	54.77.230.99	192.168.178.64	TCP	1506	443 → 59682 [ACK] Seq=2905 Ack=2284 Win=45056 Len=1452 [TCP PDU reassembled in 3086]
3084	9.075116	54.77.230.99	192.168.178.64	TCP	1506	443 → 59682 [ACK] Seq=1453 Ack=2284 Win=45056 Len=1452 [TCP PDU reassembled in 3086]
3083	9.075116	54.77.230.99	192.168.178.64	TLSv1.3	1506	Server Hello, Change Cipher Spec, Application Data
3066	9.019770	217.79.188.60	192.168.178.64	TCP	1506	443 → 59681 [ACK] Seq=1453 Ack=1906 Win=64128 Len=1452 [TCP PDU reassembled in 3067]
3065	9.019770	217.79.188.60	192.168.178.64	TLSv1.3	1506	Server Hello, Change Cipher Spec, Application Data
3032	8.940750	217.79.188.60	192.168.178.64	TCP	1506	443 → 59680 [ACK] Seq=1453 Ack=2461 Win=64128 Len=1452 [TCP PDU reassembled in 3033]
3031	8.940750	217.79.188.60	192.168.178.64	TLSv1.3	1506	Server Hello, Change Cipher Spec, Application Data
2989	8.745870	217.79.188.60	192.168.178.64	TCP	1506	443 → 59678 [ACK] Seq=1453 Ack=2461 Win=64128 Len=1452 [TCP PDU reassembled in 2990]
2988	8.745870	217.79.188.60	192.168.178.64	TLSv1.3	1506	Server Hello, Change Cipher Spec, Application Data
2983	8.731941	217.79.188.54	192.168.178.64	TCP	1506	443 → 59522 [PSH, ACK] Seq=1453 Ack=1305 Win=501 Len=1452 [TCP PDU reassembled in 2984]
2982	8.730478	217.79.188.54	192.168.178.64	TCP	1506	443 → 59522 [ACK] Seq=1 Ack=1305 Win=501 Len=1452 [TCP PDU reassembled in 2984]
2350	5.949440	34.254.143.3	192.168.178.64	TCP	1506	443 → 59672 [ACK] Seq=1453 Ack=1905 Win=30720 Len=1452 [TCP PDU reassembled in 2351]
2349	5.949440	34.254.143.3	192.168.178.64	TLSv1.2	1506	Server Hello
2344	5.947830	34.254.143.3	192.168.178.64	TCP	1506	443 → 59671 [ACK] Seq=1453 Ack=1905 Win=30720 Len=1452 [TCP PDU reassembled in 2345]
2343	5.946855	34.254.143.3	192.168.178.64	TLSv1.2	1506	Server Hello
2304	5.803391	34.242.52.142	192.168.178.64	TCP	1506	443 → 59441 [ACK] Seq=1094 Ack=1590 Win=236 Len=1452 [TCP PDU reassembled in 2305]
2187	5.506813	34.254.237.109	192.168.178.64	TCP	1506	443 → 59447 [ACK] Seq=1 Ack=2186 Win=294 Len=1452 [TCP PDU reassembled in 2188]
1989	5.426804	3.124.64.248	192.168.178.64	TCP	1506	443 → 59670 [ACK] Seq=1627 Ack=1899 Win=45056 Len=1452 [TCP PDU reassembled in 1990]
1988	5.426804	3.124.64.248	192.168.178.64	TCP	1506	443 → 59670 [ACK] Seq=175 Ack=1899 Win=45056 Len=1452 [TCP PDU reassembled in 1990]
1686	4.709220	2.23.209.164	192.168.178.64	TCP	1506	443 → 59437 [ACK] Seq=756 Ack=108 Win=501 Len=1452 [TCP PDU reassembled in 1687]
1461	4.238015	63.140.62.27	192.168.178.64	TCP	1506	443 → 59657 [PSH, ACK] Seq=1453 Ack=1906 Win=60928 Len=1452 [TCP PDU reassembled in 1462]
1460	4.238015	63.140.62.27	192.168.178.64	TLSv1.3	1506	Server Hello, Change Cipher Spec
1000	3.775969	63.140.62.17	192.168.178.64	TCP	1506	443 → 59655 [PSH, ACK] Seq=11643 Ack=9228 Win=56576 Len=1452 [TCP PDU reassembled in 1001]
999	3.775969	63.140.62.17	192.168.178.64	TCP	1506	443 → 59655 [ACK] Seq=10191 Ack=9228 Win=56576 Len=1452 [TCP PDU reassembled in 1001]
998	3.775969	63.140.62.17	192.168.178.64	TCP	1506	443 → 59655 [PSH, ACK] Seq=8739 Ack=9228 Win=56576 Len=1452 [TCP PDU reassembled in 1001]
997	3.775969	63.140.62.17	192.168.178.64	TCP	1506	443 → 59655 [ACK] Seq=7287 Ack=9228 Win=56576 Len=1452 [TCP PDU reassembled in 1001]
996	3.775969	63.140.62.17	192.168.178.64	TCP	1506	443 → 59655 [PSH, ACK] Seq=5835 Ack=9228 Win=56576 Len=1452 [TCP PDU reassembled in 1001]
995	3.775969	63.140.62.17	192.168.178.64	TCP	1506	443 → 59655 [ACK] Seq=4383 Ack=9228 Win=56576 Len=1452 [TCP PDU reassembled in 1001]
983	3.707466	63.140.62.17	192.168.178.64	TCP	1506	443 → 59655 [PSH, ACK] Seq=1453 Ack=1901 Win=60928 Len=1452 [TCP PDU reassembled in 984]
982	3.707466	63.140.62.17	192.168.178.64	TLSv1.3	1506	Server Hello, Change Cipher Spec
746	1.845196	141.95.33.120	192.168.178.64	TLSv1.3	1506	Server Hello, Change Cipher Spec, Application Data
578	1.785619	128.65.210.185	192.168.178.64	TLSv1.2	1506	Application Data
577	1.785619	128.65.210.185	192.168.178.64	TLSv1.2	1506	Application Data
576	1.785619	128.65.210.185	192.168.178.64	TLSv1.2	1506	Application Data
575	1.785619	128.65.210.185	192.168.178.64	TLSv1.2	1506	Application Data
574	1.785619	128.65.210.185	192.168.178.64	TLSv1.2	1506	Application Data, Application Data
573	1.785619	128.65.210.185	192.168.178.64	TLSv1.2	1506	Application Data
572	1.785619	128.65.210.185	192.168.178.64	TLSv1.2	1506	Application Data
571	1.785619	128.65.210.185	192.168.178.64	TLSv1.2	1506	Application Data
570	1.785619	128.65.210.185	192.168.178.64	TLSv1.2	1506	Application Data
569	1.785619	128.65.210.185	192.168.178.64	TLSv1.2	1506	Application Data
568	1.785619	128.65.210.185	192.168.178.64	TLSv1.2	1506	Application Data
567	1.785619	128.65.210.185	192.168.178.64	TLSv1.2	1506	Application Data, Application Data
566	1.785619	128.65.210.185	192.168.178.64	TLSv1.2	1506	Application Data
547	1.774556	128.65.210.185	192.168.178.64	TLSv1.2	1506	Application Data
546	1.774556	128.65.210.185	192.168.178.64	TLSv1.2	1506	Application Data
545	1.774556	128.65.210.185	192.168.178.64	TLSv1.2	1506	Application Data
544	1.774556	128.65.210.185	192.168.178.64	TLSv1.2	1506	Application Data
543	1.774556	128.65.210.185	192.168.178.64	TLSv1.2	1506	Application Data, Application Data
542	1.774556	128.65.210.185	192.168.178.64	TLSv1.2	1506	Application Data
541	1.774556	128.65.210.185	192.168.178.64	TLSv1.2	1506	Application Data
539	1.774099	128.65.210.185	192.168.178.64	TLSv1.2	1506	Application Data
538	1.774099	128.65.210.185	192.168.178.64	TLSv1.2	1506	Application Data
537	1.774099	128.65.210.185	192.168.178.64	TLSv1.2	1506	Application Data
536	1.774099	128.65.210.185	192.168.178.64	TLSv1.2	1506	Application Data
535	1.774099	128.65.210.185	192.168.178.64	TLSv1.2	1506	Application Data
534	1.774099	128.65.210.185	192.168.178.64	TLSv1.2	1506	Application Data
533	1.774099	128.65.210.185	192.168.178.64	TLSv1.2	1506	Application Data
532	1.774099	128.65.210.185	192.168.178.64	TLSv1.2	1506	Application Data, Application Data
531	1.774099	128.65.210.185	192.168.178.64	TLSv1.2	1506	Application Data
530	1.774099	128.65.210.185	192.168.178.64	TLSv1.2	1506	Application Data
529	1.774099	128.65.210.185	192.168.178.64	TLSv1.2	1506	Application Data
528	1.774099	128.65.210.185	192.168.178.64	TLSv1.2	1506	Application Data
527	1.774099	128.65.210.185	192.168.178.64	TLSv1.2	1506	Application Data
526	1.774099	128.65.210.185	192.168.178.64	TLSv1.2	1506	Application Data, Application Data
525	1.774099	128.65.210.185	192.168.178.64	TLSv1.2	1506	Application Data
524	1.774099	128.65.210.185	192.168.178.64	TLSv1.2	1506	Application Data
523	1.774099	128.65.210.185	192.168.178.64	TLSv1.2	1506	Application Data
522	1.774099	128.65.210.185	192.168.178.64	TLSv1.2	1506	Application Data
521	1.774099	128.65.210.185	192.168.178.64	TLSv1.2	1506	Application Data
520	1.774099	128.65.210.185	192.168.178.64	TLSv1.2	1506	Application Data
519	1.774099	128.65.210.185	192.168.178.64	TLSv1.2	1506	Application Data, Application Data
518	1.774099	128.65.210.185	192.168.178.64	TLSv1.2	1506	Application Data
517	1.774099	128.65.210.185	192.168.178.64	TLSv1.2	1506	Application Data
516	1.774099	128.65.210.185	192.168.178.64	TLSv1.2	1506	Application Data
515	1.774099	128.65.210.185	192.168.178.64	TLSv1.2	1506	Application Data
514	1.774099	128.65.210.185	192.168.178.64	TLSv1.2	1506	Application Data
513	1.774099	128.65.210.185	192.168.178.64	TLSv1.2	1506	Application Data
512	1.774099	128.65.210.185	192.168.178.64	TLSv1.2	1506	Application Data
511	1.774099	128.65.210.185	192.168.178.64	TLSv1.2	1506	Application Data
510	1.774099	128.65.210.185	192.168.178.64	TLSv1.2	1506	Application Data
509	1.774099	128.65.210.185	192.168.178.64	TLSv1.2	1506	Application Data, Application Data
508	1.774099	128.65.210.185	192.168.178.64	TLSv1.2	1506	Application Data
503	1.772631	128.65.210.185	192.168.178.64	TLSv1.2	1506	Application Data
502	1.772631	128.65.210.185	192.168.178.64	TLSv1.2	1506	Application Data
501	1.772631	128.65.210.185	192.168.178.64	TLSv1.2	1506	Application Data
500	1.772631	128.65.210.185	192.168.178.64	TLSv1.2	1506	Application Data
499	1.772631	128.65.210.185	192.168.178.64	TLSv1.2	1506	Application Data, Application Data
498	1.772631	128.65.210.185	192.168.178.64	TLSv1.2	1506	Application Data
497	1.772631	128.65.210.185	192.168.178.64	TLSv1.2	1506	Application Data
496	1.772631	128.65.210.185	192.168.178.64	TLSv1.2	1506	Application Data
495	1.772631	128.65.210.185	192.168.178.64	TLSv1.2	1506	Application Data
490	1.771675	128.65.210.185	192.168.178.64	TLSv1.2	1506	Application Data
489	1.771675	128.65.210.185	192.168.178.64	TLSv1.2	1506	Application Data
488	1.771675	128.65.210.185	192.168.178.64	TLSv1.2	1506	Application Data, Application Data
487	1.771675	128.65.210.185	192.168.178.64	TLSv1.2	1506	Application Data
486	1.771675	128.65.210.185	192.168.178.64	TLSv1.2	1506	Application Data
485	1.771675	128.65.210.185	192.168.178.64	TLSv1.2	1506	Application Data
484	1.771675	128.65.210.185	192.168.178.64	TLSv1.2	1506	Application Data
483	1.771675	128.65.210.185	192.168.178.64	TLSv1.2	1506	Application Data
481	1.771675	128.65.210.185	192.168.178.64	TLSv1.2	1506	Application Data
480	1.771675	128.65.210.185	192.168.178.64	TLSv1.2	1506	Application Data
479	1.771675	128.65.210.185	192.168.178.64	TLSv1.2	1506	Application Data
478	1.771675	128.65.210.185	192.168.178.64	TLSv1.2	1506	Application Data, Application Data
477	1.771675	128.65.210.185	192.168.178.64	TLSv1.2	1506	Application Data
476	1.771675	128.65.210.185	192.168.178.64	TLSv1.2	1506	Application Data
475	1.771675	128.65.210.185	192.168.178.64	TLSv1.2	1506	Application Data
474	1.771675	128.65.210.185	192.168.178.64	TLSv1.2	1506	Application Data
473	1.771675	128.65.210.185	192.168.178.64	TLSv1.2	1506	Application Data
472	1.771675	128.65.210.185	192.168.178.64	TLSv1.2	1506	Application Data, Application Data
468	1.770774	128.65.210.185	192.168.178.64	TLSv1.2	1506	Application Data
467	1.770774	128.65.210.185	192.168.178.64	TLSv1.2	1506	Application Data
466	1.770774	128.65.210.185	192.168.178.64	TLSv1.2	1506	Application Data
465	1.770774	128.65.210.185	192.168.178.64	TLSv1.2	1506	Application Data
464	1.770774	128.65.210.185	192.168.178.64	TLSv1.2	1506	Application Data
463	1.770774	128.65.210.185	192.168.178.64	TLSv1.2	1506	Application Data
462	1.770774	128.65.210.185	192.168.178.64	TLSv1.2	1506	Application Data
461	1.770774	128.65.210.185	192.168.178.64	TLSv1.2	1506	Application Data, Application Data
460	1.770774	128.65.210.185	192.168.178.64	TLSv1.2	1506	Application Data
459	1.770774	128.65.210.185	192.168.178.64	TLSv1.2	1506	Application Data
458	1.770774	128.65.210.185	192.168.178.64	TLSv1.2	1506	Application Data
457	1.770774	128.65.210.185	192.168.178.64	TLSv1.2	1506	Application Data
456	1.770774	128.65.210.185	192.168.178.64	TLSv1.2	1506	Application Data
455	1.770774	128.65.210.185	192.168.178.64	TLSv1.2	1506	Application Data
425	1.759258	128.65.210.185	192.168.178.64	TLSv1.2	1506	Application Data
424	1.759258	128.65.210.185	192.168.178.64	TLSv1.2	1506	Application Data
423	1.759258	128.65.210.185	192.168.178.64	TLSv1.2	1506	Application Data, Application Data
422	1.759258	128.65.210.185	192.168.178.64	TLSv1.2	1506	Application Data
421	1.759258	128.65.210.185	192.168.178.64	TLSv1.2	1506	Application Data
420	1.759258	128.65.210.185	192.168.178.64	TLSv1.2	1506	Application Data
418	1.758179	128.65.210.185	192.168.178.64	TLSv1.2	1506	Application Data
417	1.758179	128.65.210.185	192.168.178.64	TLSv1.2	1506	Application Data
416	1.758179	128.65.210.185	192.168.178.64	TLSv1.2	1506	Application Data, Application Data
413	1.756808	128.65.210.185	192.168.178.64	TLSv1.2	1506	Application Data
412	1.756808	128.65.210.185	192.168.178.64	TLSv1.2	1506	Application Data
411	1.756808	128.65.210.185	192.168.178.64	TLSv1.2	1506	Application Data
410	1.756808	128.65.210.185	192.168.178.64	TLSv1.2	1506	Application Data
409	1.756808	128.65.210.185	192.168.178.64	TLSv1.2	1506	Application Data
408	1.756808	128.65.210.185	192.168.178.64	TLSv1.2	1506	Application Data
407	1.756808	128.65.210.185	192.168.178.64	TLSv1.2	1506	Application Data
406	1.756808	128.65.210.185	192.168.178.64	TLSv1.2	1506	Application Data, Application Data
405	1.756808	128.65.210.185	192.168.178.64	TLSv1.2	1506	Application Data
404	1.756808	128.65.210.185	192.168.178.64	TLSv1.2	1506	Application Data
403	1.756808	128.65.210.185	192.168.178.64	TLSv1.2	1506	Application Data
402	1.756808	128.65.210.185	192.168.178.64	TLSv1.2	1506	Application Data
401	1.756808	128.65.210.185	192.168.178.64	TLSv1.2	1506	Application Data
400	1.756808	128.65.210.185	192.168.178.64	TLSv1.2	1506	Application Data
399	1.756808	128.65.210.185	192.168.178.64	TLSv1.2	1506	Application Data
396	1.756100	128.65.210.185	192.168.178.64	TLSv1.2	1506	Application Data, Application Data
395	1.756100	128.65.210.185	192.168.178.64	TLSv1.2	1506	Application Data
394	1.756100	128.65.210.185	192.168.178.64	TLSv1.2	1506	Application Data
393	1.756100	128.65.210.185	192.168.178.64	TLSv1.2	1506	Application Data, Application Data
392	1.756100	128.65.210.185	192.168.178.64	TLSv1.2	1506	Application Data
391	1.756100	128.65.210.185	192.168.178.64	TLSv1.2	1506	Application Data
389	1.755575	128.65.210.185	192.168.178.64	TLSv1.2	1506	Application Data
388	1.755575	128.65.210.185	192.168.178.64	TLSv1.2	1506	Application Data
387	1.755575	128.65.210.185	192.168.178.64	TLSv1.2	1506	Application Data
386	1.755575	128.65.210.185	192.168.178.64	TLSv1.2	1506	Application Data
385	1.755575	128.65.210.185	192.168.178.64	TLSv1.2	1506	Application Data
384	1.755575	128.65.210.185	192.168.178.64	TLSv1.2	1506	Application Data, Application Data
383	1.755575	128.65.210.185	192.168.178.64	TLSv1.2	1506	Application Data
382	1.755575	128.65.210.185	192.168.178.64	TLSv1.2	1506	Application Data
381	1.755575	128.65.210.185	192.168.178.64	TLSv1.2	1506	Application Data
380	1.755575	128.65.210.185	192.168.178.64	TLSv1.2	1506	Application Data, Application Data
340	1.742756	128.65.210.185	192.168.178.64	TLSv1.2	1506	Application Data
338	1.742756	128.65.210.185	192.168.178.64	TLSv1.2	1506	Application Data
332	1.740790	128.65.210.185	192.168.178.64	TLSv1.2	1506	Application Data
331	1.740790	128.65.210.185	192.168.178.64	TLSv1.2	1506	Application Data
330	1.740790	128.65.210.185	192.168.178.64	TLSv1.2	1506	Application Data
329	1.740790	128.65.210.185	192.168.178.64	TLSv1.2	1506	Application Data, Application Data
328	1.740790	128.65.210.185	192.168.178.64	TLSv1.2	1506	Application Data
327	1.740790	128.65.210.185	192.168.178.64	TLSv1.2	1506	Application Data
326	1.740790	128.65.210.185	192.168.178.64	TLSv1.2	1506	Application Data
325	1.740790	128.65.210.185	192.168.178.64	TLSv1.2	1506	Application Data
324	1.740790	128.65.210.185	192.168.178.64	TLSv1.2	1506	Application Data
323	1.740790	128.65.210.185	192.168.178.64	TLSv1.2	1506	Application Data
322	1.740790	128.65.210.185	192.168.178.64	TLSv1.2	1506	Application Data
321	1.740790	128.65.210.185	192.168.178.64	TLSv1.2	1506	Application Data
320	1.740790	128.65.210.185	192.168.178.64	TLSv1.2	1506	Application Data
316	1.739501	128.65.210.185	192.168.178.64	TLSv1.2	1506	Application Data, Application Data
315	1.739501	128.65.210.185	192.168.178.64	TLSv1.2	1506	Application Data
314	1.739501	128.65.210.185	192.168.178.64	TLSv1.2	1506	Application Data
313	1.739501	128.65.210.185	192.168.178.64	TLSv1.2	1506	Application Data
312	1.739501	128.65.210.185	192.168.178.64	TLSv1.2	1506	Application Data
278	1.726506	128.65.210.185	192.168.178.64	TLSv1.2	1506	Application Data
272	1.725733	128.65.210.185	192.168.178.64	TLSv1.2	1506	Application Data
270	1.725733	128.65.210.185	192.168.178.64	TLSv1.2	1506	Application Data
263	1.723798	128.65.210.185	192.168.178.64	TLSv1.2	1506	Application Data
2439	6.454284	52.95.126.160	192.168.178.64	TCP	1494	443 → 59673 [ACK] Seq=324 Ack=3483 Win=59392 Len=1440 [TCP PDU reassembled in 2440]
2002	5.428575	37.252.171.85	192.168.178.64	TLSv1.2	1494	Server Hello
304	1.738529	52.85.67.113	192.168.178.64	TCP	1494	443 → 59647 [PSH, ACK] Seq=2881 Ack=1907 Win=69632 Len=1440 [TCP PDU reassembled in 333]
303	1.738529	52.85.67.113	192.168.178.64	TCP	1494	443 → 59647 [ACK] Seq=1441 Ack=1907 Win=69632 Len=1440 [TCP PDU reassembled in 333]
302	1.738529	52.85.67.113	192.168.178.64	TLSv1.3	1494	Server Hello, Change Cipher Spec, Application Data
935	3.102112	52.219.72.215	192.168.178.64	TCP	1486	443 → 59654 [ACK] Seq=3078 Ack=1915 Win=64256 Len=1432 [TCP PDU reassembled in 936]
934	3.102112	52.219.72.215	192.168.178.64	TCP	1486	443 → 59654 [ACK] Seq=1646 Ack=1915 Win=64256 Len=1432 [TCP PDU reassembled in 936]
933	3.102112	52.219.72.215	192.168.178.64	TCP	1486	443 → 59654 [ACK] Seq=214 Ack=1915 Win=64256 Len=1432 [TCP PDU reassembled in 936]
648	1.813552	52.219.72.215	192.168.178.64	TCP	1486	443 → 59650 [ACK] Seq=3078 Ack=1915 Win=64256 Len=1432 [TCP PDU reassembled in 649]
647	1.813552	52.219.72.215	192.168.178.64	TCP	1486	443 → 59650 [ACK] Seq=1646 Ack=1915 Win=64256 Len=1432 [TCP PDU reassembled in 649]
642	1.812720	52.219.72.215	192.168.178.64	TCP	1486	443 → 59650 [ACK] Seq=214 Ack=1915 Win=64256 Len=1432 [TCP PDU reassembled in 649]
3407	10.517564	185.184.8.90	192.168.178.64	TLSv1.2	1477	Application Data
3659	11.070855	35.210.58.154	192.168.178.64	TCP	1474	443 → 59667 [ACK] Seq=21506 Ack=64312 Win=82176 Len=1420 [TCP PDU reassembled in 3660]
2270	5.562246	35.210.58.154	192.168.178.64	TCP	1474	443 → 59667 [ACK] Seq=19748 Ack=62829 Win=79232 Len=1420 [TCP PDU reassembled in 2271]
2266	5.559887	35.210.58.154	192.168.178.64	TCP	1474	443 → 59667 [ACK] Seq=17994 Ack=62829 Win=79232 Len=1420 [TCP PDU reassembled in 2267]
2260	5.552373	35.210.58.154	192.168.178.64	TCP	1474	443 → 59667 [ACK] Seq=16243 Ack=62829 Win=79232 Len=1420 [TCP PDU reassembled in 2261]
2256	5.548975	35.210.58.154	192.168.178.64	TCP	1474	443 → 59667 [ACK] Seq=14486 Ack=62829 Win=79232 Len=1420 [TCP PDU reassembled in 2257]
2251	5.543584	35.210.58.154	192.168.178.64	TCP	1474	443 → 59667 [ACK] Seq=12732 Ack=62829 Win=79232 Len=1420 [TCP PDU reassembled in 2252]
2236	5.528378	35.210.58.154	192.168.178.64	TCP	1474	443 → 59667 [ACK] Seq=10977 Ack=62829 Win=79232 Len=1420 [TCP PDU reassembled in 2237]
2221	5.521553	35.210.58.154	192.168.178.64	TCP	1474	443 → 59667 [ACK] Seq=9187 Ack=53286 Win=59392 Len=1420 [TCP PDU reassembled in 2222]
2211	5.515503	35.210.58.154	192.168.178.64	TCP	1474	443 → 59667 [ACK] Seq=7398 Ack=46186 Win=45184 Len=1420 [TCP PDU reassembled in 2212]
2190	5.506813	35.210.58.154	192.168.178.64	TCP	1474	443 → 59667 [ACK] Seq=5644 Ack=46186 Win=45184 Len=1420 [TCP PDU reassembled in 2191]
2183	5.500606	35.210.58.154	192.168.178.64	TCP	1474	443 → 59667 [ACK] Seq=3889 Ack=46186 Win=45184 Len=1420 [TCP PDU reassembled in 2184]
1992	5.426804	35.210.58.154	192.168.178.64	TLSv1.3	1474	Application Data
1991	5.426804	35.210.58.154	192.168.178.64	TLSv1.3	1474	Server Hello, Change Cipher Spec, Application Data
3080	9.045932	217.79.188.60	192.168.178.64	TLSv1.3	1470	Application Data
3667	11.076588	69.173.144.165	192.168.178.64	TLSv1.2	1454	Server Hello
3559	11.003059	37.252.171.85	192.168.178.64	TLSv1.2	1453	Application Data
3552	10.999312	69.173.144.138	192.168.178.64	TLSv1.2	1451	Application Data
3780	11.430144	69.173.144.165	192.168.178.64	TLSv1.2	1443	Application Data
3644	11.059936	69.173.144.165	192.168.178.64	TLSv1.2	1443	Application Data
3553	11.000390	69.173.144.138	192.168.178.64	TCP	1443	443 → 59530 [PSH, ACK] Seq=1398 Ack=1305 Win=14520 Len=1389 [TCP PDU reassembled in 3556]
2468	6.822305	37.252.171.85	192.168.178.64	TLSv1.2	1443	Application Data
3781	11.431255	69.173.144.165	192.168.178.64	TCP	1435	443 → 59542 [PSH, ACK] Seq=6746 Ack=2482 Win=20328 Len=1381 [TCP PDU reassembled in 3783]
3645	11.061330	69.173.144.165	192.168.178.64	TCP	1435	443 → 59542 [PSH, ACK] Seq=1390 Ack=1242 Win=18150 Len=1381 [TCP PDU reassembled in 3647]
3555	11.000390	69.173.144.138	192.168.178.64	TCP	1422	443 → 59530 [PSH, ACK] Seq=4155 Ack=1305 Win=14520 Len=1368 [TCP PDU reassembled in 3556]
3554	11.000390	69.173.144.138	192.168.178.64	TCP	1422	443 → 59530 [PSH, ACK] Seq=2787 Ack=1305 Win=14520 Len=1368 [TCP PDU reassembled in 3556]
3668	11.076588	69.173.144.165	192.168.178.64	TCP	1418	443 → 59689 [PSH, ACK] Seq=1401 Ack=1910 Win=23232 Len=1364 [TCP PDU reassembled in 3669]
3782	11.431255	69.173.144.165	192.168.178.64	TCP	1414	443 → 59542 [PSH, ACK] Seq=8127 Ack=2482 Win=20328 Len=1360 [TCP PDU reassembled in 3783]
3646	11.061330	69.173.144.165	192.168.178.64	TCP	1414	443 → 59542 [PSH, ACK] Seq=2771 Ack=1242 Win=18150 Len=1360 [TCP PDU reassembled in 3647]
2397	6.192467	37.252.171.85	192.168.178.64	TLSv1.2	1402	Application Data
269	1.725733	128.65.210.185	192.168.178.64	TLSv1.2	1376	Application Data
262	1.723798	128.65.210.185	192.168.178.64	TLSv1.2	1376	Application Data
3675	11.082355	37.252.171.85	192.168.178.64	TLSv1.2	1365	Application Data
3734	11.220130	37.252.171.85	192.168.178.64	TLSv1.2	1364	Application Data
261	1.723798	128.65.210.185	192.168.178.64	TLSv1.2	1341	Application Data
936	3.102112	52.219.72.215	192.168.178.64	TLSv1.3	1337	Application Data
649	1.813552	52.219.72.215	192.168.178.64	TLSv1.3	1337	Application Data
2442	6.455526	37.252.171.85	192.168.178.64	TLSv1.2	1312	Application Data
2382	6.079376	37.252.171.85	192.168.178.64	TLSv1.2	1310	Application Data
1635	4.652577	63.35.45.179	192.168.178.64	TLSv1.2	1296	Application Data
3760	11.379951	37.252.171.85	192.168.178.64	TLSv1.2	1289	Application Data
2351	5.949440	34.254.143.3	192.168.178.64	TLSv1.2	1285	Certificate, Server Key Exchange, Server Hello Done
2345	5.947830	34.254.143.3	192.168.178.64	TLSv1.2	1285	Certificate, Server Key Exchange, Server Hello Done
3783	11.431255	69.173.144.165	192.168.178.64	TLSv1.2	1280	Application Data
3647	11.061330	69.173.144.165	192.168.178.64	TLSv1.2	1280	Application Data
2003	5.428575	37.252.171.85	192.168.178.64	TLSv1.2	1279	Certificate, Certificate Status, Server Key Exchange, Server Hello Done
3594	11.023393	37.157.2.14	192.168.178.64	TLSv1.2	1275	Application Data
3121	9.171071	54.77.230.99	192.168.178.64	TLSv1.3	1275	Application Data, Application Data
3067	9.019770	217.79.188.60	192.168.178.64	TLSv1.3	1246	Application Data
3033	8.940750	217.79.188.60	192.168.178.64	TLSv1.3	1246	Application Data
2990	8.745870	217.79.188.60	192.168.178.64	TLSv1.3	1246	Application Data
271	1.725733	128.65.210.185	192.168.178.64	TLSv1.2	1246	Application Data
264	1.723798	128.65.210.185	192.168.178.64	TLSv1.2	1246	Application Data
2416	6.322547	37.252.171.85	192.168.178.64	TLSv1.2	1241	Application Data
2305	5.803391	34.242.52.142	192.168.178.64	TLSv1.2	1221	Application Data
3423	10.530523	35.214.136.108	192.168.178.64	TLSv1.2	1175	Application Data
3358	10.169595	52.50.128.177	192.168.178.64	TLSv1.2	1160	Application Data
3217	9.849976	76.223.111.18	192.168.178.64	TLSv1.2	1131	Application Data
279	1.726506	128.65.210.185	192.168.178.64	TLSv1.2	1116	Application Data
1619	4.646430	34.242.52.142	192.168.178.64	TLSv1.2	1109	Application Data
3432	10.538859	37.252.171.85	192.168.178.64	TLSv1.2	1075	Application Data
3752	11.368391	37.252.171.85	192.168.178.64	TLSv1.2	1070	Application Data
2404	6.280270	108.138.38.29	192.168.178.64	TLSv1.2	1005	Application Data
747	1.845196	141.95.33.120	192.168.178.64	TLSv1.3	999	Application Data, Application Data, Application Data
1990	5.426804	3.124.64.248	192.168.178.64	TLSv1.3	969	Application Data
2284	5.629901	184.28.88.119	192.168.178.64	TLSv1.2	917	Application Data
2241	5.528378	184.28.88.119	192.168.178.64	TLSv1.2	917	Application Data
3556	11.000390	69.173.144.138	192.168.178.64	TLSv1.2	906	Application Data
3531	10.978130	178.250.7.13	192.168.178.64	TLSv1.2	824	Application Data
1685	4.709220	2.23.209.164	192.168.178.64	TLSv1.2	809	Application Data
3877	11.674068	178.250.1.11	192.168.178.64	TLSv1.2	793	Application Data
1001	3.775969	63.140.62.17	192.168.178.64	TLSv1.3	784	Application Data
2399	6.244945	2.23.209.164	192.168.178.64	TLSv1.2	780	Application Data
994	3.774486	63.140.62.17	192.168.178.64	TLSv1.3	770	Application Data
3240	9.880935	63.140.62.17	192.168.178.64	TLSv1.3	762	Application Data
3015	8.840816	63.140.62.17	192.168.178.64	TLSv1.3	760	Application Data
2283	5.623433	3.124.64.248	192.168.178.64	TLSv1.3	743	Application Data
588	1.786737	128.65.210.185	192.168.178.64	TLSv1.2	732	Application Data
3145	9.218470	136.243.25.87	192.168.178.64	TLSv1.3	695	Application Data
950	3.195612	52.85.65.72	192.168.178.64	TLSv1.2	689	Application Data
2445	6.517212	52.95.126.160	192.168.178.64	TLSv1.3	684	Application Data
3826	11.536838	37.252.171.85	192.168.178.64	TLSv1.2	616	Application Data
3776	11.399329	37.252.171.85	192.168.178.64	TLSv1.2	616	Application Data
3463	10.596523	46.228.174.117	192.168.178.64	TLSv1.2	613	Application Data
3565	11.009435	184.28.88.119	192.168.178.64	TLSv1.2	611	Application Data
2231	5.522883	37.157.6.237	192.168.178.64	TLSv1.2	606	Application Data
1471	4.270251	63.140.62.27	192.168.178.64	TLSv1.3	581	Application Data, Application Data
991	3.737071	63.140.62.17	192.168.178.64	TLSv1.3	581	Application Data, Application Data
3772	11.389016	37.157.2.14	192.168.178.64	TLSv1.2	575	Application Data
333	1.740790	52.85.67.113	192.168.178.64	TLSv1.3	569	Application Data, Application Data, Application Data
1480	4.297365	63.140.62.27	192.168.178.64	TLSv1.3	555	Application Data
3456	10.578739	37.157.2.13	192.168.178.64	TLSv1.2	550	Application Data
2984	8.731941	217.79.188.54	192.168.178.64	TLSv1.2	494	Application Data
3909	11.837087	184.28.88.119	192.168.178.64	TLSv1.2	482	Application Data
3898	11.759096	184.28.88.119	192.168.178.64	TLSv1.2	482	Application Data
3895	11.737082	184.28.88.119	192.168.178.64	TLSv1.2	482	Application Data
3889	11.727120	184.28.88.119	192.168.178.64	TLSv1.2	482	Application Data
3876	11.666364	184.28.88.119	192.168.178.64	TLSv1.2	482	Application Data
3775	11.395908	184.28.88.119	192.168.178.64	TLSv1.2	482	Application Data
3773	11.392273	184.28.88.119	192.168.178.64	TLSv1.2	482	Application Data
3757	11.371008	184.28.88.119	192.168.178.64	TLSv1.2	482	Application Data
3536	10.985573	35.214.136.108	192.168.178.64	TLSv1.2	481	Application Data
3729	11.156730	185.235.86.81	192.168.178.64	TLSv1.3	465	Application Data
3660	11.070855	35.210.58.154	192.168.178.64	TLSv1.3	465	Application Data
3336	10.140615	184.28.88.119	192.168.178.64	TLSv1.2	458	Application Data
3317	10.128672	184.28.88.119	192.168.178.64	TLSv1.2	458	Application Data
3723	11.154685	185.235.86.5	192.168.178.64	TLSv1.3	452	Application Data
3086	9.075116	54.77.230.99	192.168.178.64	TLSv1.3	431	Application Data, Application Data, Application Data
2374	6.029478	34.254.143.3	192.168.178.64	TLSv1.2	407	Application Data
2199	5.509057	95.101.149.35	192.168.178.64	TLSv1.2	406	Application Data
2222	5.521553	35.210.58.154	192.168.178.64	TLSv1.3	389	Application Data, Application Data
2200	5.509057	95.101.149.35	192.168.178.64	TLSv1.2	381	Application Data
3572	11.011470	76.223.111.18	192.168.178.64	TLSv1.2	371	Application Data
3068	9.019770	217.79.188.60	192.168.178.64	TLSv1.3	369	Application Data, Application Data
3034	8.940750	217.79.188.60	192.168.178.64	TLSv1.3	369	Application Data, Application Data
2991	8.745870	217.79.188.60	192.168.178.64	TLSv1.3	369	Application Data, Application Data
1993	5.426804	35.210.58.154	192.168.178.64	TLSv1.3	367	Application Data, Application Data
3669	11.076588	69.173.144.165	192.168.178.64	TLSv1.2	364	Certificate, Server Hello Done
1250	4.000029	63.140.62.17	192.168.178.64	TLSv1.3	362	Application Data
3077	9.044973	217.79.188.60	192.168.178.64	TLSv1.3	361	Application Data, Application Data
2271	5.562246	35.210.58.154	192.168.178.64	TLSv1.3	361	Application Data
2257	5.548975	35.210.58.154	192.168.178.64	TLSv1.3	360	Application Data
2188	5.506813	34.254.237.109	192.168.178.64	TLSv1.2	360	Application Data
2237	5.528378	35.210.58.154	192.168.178.64	TLSv1.3	358	Application Data
2184	5.500606	35.210.58.154	192.168.178.64	TLSv1.3	358	Application Data
2267	5.559887	35.210.58.154	192.168.178.64	TLSv1.3	357	Application Data
2252	5.543584	35.210.58.154	192.168.178.64	TLSv1.3	357	Application Data
2212	5.515503	35.210.58.154	192.168.178.64	TLSv1.3	357	Application Data
2191	5.506813	35.210.58.154	192.168.178.64	TLSv1.3	357	Application Data
2261	5.552373	35.210.58.154	192.168.178.64	TLSv1.3	354	Application Data
3351	10.160362	23.213.161.14	192.168.178.64	TLSv1.3	341	Application Data
3143	9.207884	136.243.25.87	192.168.178.64	TLSv1.3	341	Application Data
3142	9.207884	136.243.25.87	192.168.178.64	TLSv1.3	341	Application Data
3140	9.206880	136.243.25.87	192.168.178.64	TLSv1.3	341	Application Data
3139	9.206880	136.243.25.87	192.168.178.64	TLSv1.3	341	Application Data
100	1.583992	2.23.209.144	192.168.178.64	TLSv1.3	341	Application Data
1996	5.427475	3.124.64.248	192.168.178.64	TLSv1.3	340	Application Data
938	3.103981	52.219.72.215	192.168.178.64	TLSv1.3	340	Application Data
650	1.813552	52.219.72.215	192.168.178.64	TLSv1.3	340	Application Data
1858	5.238497	63.140.62.27	192.168.178.64	TLSv1.3	334	Application Data
1489	4.305544	63.140.62.27	192.168.178.64	TLSv1.3	332	Application Data
1481	4.297365	63.140.62.27	192.168.178.64	TLSv1.3	332	Application Data
2058	5.451170	37.252.171.85	192.168.178.64	TLSv1.2	328	New Session Ticket, Change Cipher Spec, Encrypted Handshake Message
3342	10.145988	23.213.161.14	192.168.178.64	TLSv1.3	324	Server Hello, Change Cipher Spec, Application Data, Application Data
3441	10.545877	46.228.174.117	192.168.178.64	TLSv1.2	319	Server Key Exchange, Server Hello Done
80	1.569766	2.23.209.144	192.168.178.64	TLSv1.3	318	Server Hello, Change Cipher Spec, Application Data, Application Data
3076	9.044973	217.79.188.60	192.168.178.64	TLSv1.3	309	Application Data
2996	8.765284	217.79.188.60	192.168.178.64	TLSv1.3	309	Application Data
2995	8.765284	217.79.188.60	192.168.178.64	TLSv1.3	309	Application Data
2434	6.409716	52.95.126.160	192.168.178.64	TLSv1.3	298	Server Hello, Change Cipher Spec, Application Data, Application Data
2430	6.408383	52.95.126.160	192.168.178.64	TLSv1.3	298	Server Hello, Change Cipher Spec, Application Data, Application Data
3716	11.129460	185.235.86.81	192.168.178.64	TLSv1.3	296	Server Hello, Change Cipher Spec, Application Data, Application Data
3714	11.129460	185.235.86.5	192.168.178.64	TLSv1.3	296	Server Hello, Change Cipher Spec, Application Data, Application Data
3452	10.573887	46.228.174.117	192.168.178.64	TLSv1.2	296	New Session Ticket, Change Cipher Spec, Encrypted Handshake Message
984	3.707466	63.140.62.17	192.168.178.64	TLSv1.3	289	Application Data
1687	4.709220	2.23.209.164	192.168.178.64	TLSv1.2	286	Application Data
3134	9.190110	136.243.25.87	192.168.178.64	TLSv1.3	278	Application Data, Application Data
3128	9.187972	136.243.25.87	192.168.178.64	TLSv1.3	278	Application Data, Application Data
3605	11.027007	46.228.174.117	192.168.178.64	TLSv1.2	275	Application Data
3453	10.573887	54.171.245.237	192.168.178.64	TLSv1.2	268	Application Data
3470	10.804217	52.50.128.177	192.168.178.64	TLSv1.2	265	Application Data
1857	5.238497	63.140.62.27	192.168.178.64	TLSv1.3	259	Application Data
1462	4.238015	63.140.62.27	192.168.178.64	TLSv1.3	254	Application Data
3178	9.558800	54.77.230.99	192.168.178.64	TLSv1.3	244	Application Data
1488	4.305544	63.140.62.27	192.168.178.64	TLSv1.3	237	Application Data
1249	4.000029	63.140.62.17	192.168.178.64	TLSv1.3	236	Application Data
3093	9.118925	54.77.230.99	192.168.178.64	TLSv1.3	233	Application Data
429	1.759925	52.85.67.113	192.168.178.64	TLSv1.3	233	Application Data
2157	5.497564	35.210.58.154	192.168.178.64	TLSv1.3	223	Application Data
930	3.102112	52.219.72.215	192.168.178.64	TLSv1.3	214	Server Hello
638	1.811900	52.219.72.215	192.168.178.64	TLSv1.3	214	Server Hello
3892	11.731783	184.28.88.119	192.168.178.64	TLSv1.2	206	Server Hello, Change Cipher Spec, Encrypted Handshake Message
3753	11.368391	76.223.111.18	192.168.178.64	TLSv1.2	206	Application Data
3606	11.027007	185.184.8.90	192.168.178.64	TLSv1.2	200	Application Data
3346	10.150150	184.28.88.244	192.168.178.64	TLSv1.2	200	Server Hello, Change Cipher Spec, Encrypted Handshake Message
2361	5.959500	18.159.188.190	192.168.178.64	TLSv1.2	192	Application Data
1985	5.426804	3.124.64.248	192.168.178.64	TLSv1.3	181	Server Hello
2440	6.454284	52.95.126.160	192.168.178.64	TLSv1.3	175	Application Data
3363	10.440505	76.223.111.18	192.168.178.64	TLSv1.2	170	Application Data
3103	9.125970	54.77.230.99	192.168.178.64	TLSv1.3	144	Application Data
2438	6.449692	52.95.126.160	192.168.178.64	TLSv1.3	133	Application Data
2437	6.448476	52.95.126.160	192.168.178.64	TLSv1.3	133	Application Data
2054	5.450089	35.210.58.154	192.168.178.64	TLSv1.3	133	Application Data
2053	5.450089	35.210.58.154	192.168.178.64	TLSv1.3	133	Application Data
796	1.863748	141.95.33.120	192.168.178.64	TLSv1.3	133	Application Data
795	1.863748	141.95.33.120	192.168.178.64	TLSv1.3	133	Application Data
2141	5.476060	185.64.189.112	192.168.178.64	TLSv1.2	132	Application Data
3766	11.382404	35.214.136.108	192.168.178.64	TLSv1.2	128	Application Data
3608	11.028371	35.214.136.108	192.168.178.64	TLSv1.2	128	Application Data
2059	5.451170	37.252.171.85	192.168.178.64	TLSv1.2	123	Application Data
3354	10.162854	184.28.88.244	192.168.178.64	TLSv1.2	122	Application Data
3728	11.156730	185.235.86.81	192.168.178.64	TLSv1.3	118	Application Data
3722	11.154685	185.235.86.5	192.168.178.64	TLSv1.3	118	Application Data
2091	5.456298	3.124.64.248	192.168.178.64	TLSv1.3	118	Application Data
3765	11.382404	35.214.136.108	192.168.178.64	TLSv1.2	116	Application Data
3607	11.028371	35.214.136.108	192.168.178.64	TLSv1.2	116	Application Data
3094	9.118925	54.77.230.99	192.168.178.64	TLSv1.3	116	Application Data
2055	5.450089	35.210.58.154	192.168.178.64	TLSv1.3	116	Application Data
430	1.759925	52.85.67.113	192.168.178.64	TLSv1.3	116	Application Data
102	1.583992	2.23.209.144	192.168.178.64	TLSv1.3	115	Application Data
3461	10.595547	46.228.174.117	192.168.178.64	TLSv1.2	113	Application Data
1997	5.427475	3.124.64.248	192.168.178.64	TLSv1.3	112	Application Data
942	3.108302	52.219.72.215	192.168.178.64	TCP	112	[TCP Spurious Retransmission] 443 → 59654 [PSH, ACK] Seq=6079 Ack=1915 Win=64256 Len=58
939	3.103981	52.219.72.215	192.168.178.64	TLSv1.3	112	Application Data
798	1.864938	141.95.33.120	192.168.178.64	TLSv1.3	112	Application Data
668	1.819175	52.219.72.215	192.168.178.64	TCP	112	[TCP Retransmission] 443 → 59650 [PSH, ACK] Seq=6079 Ack=1915 Win=64256 Len=58
657	1.814387	52.219.72.215	192.168.178.64	TLSv1.3	112	Application Data
2170	5.497564	37.252.171.85	192.168.178.64	TLSv1.2	109	Application Data
2377	6.048001	34.254.143.3	192.168.178.64	TLSv1.2	107	Application Data
2372	6.028708	34.254.143.3	192.168.178.64	TLSv1.2	107	Application Data
3692	11.094089	69.173.144.165	192.168.178.64	TLSv1.2	105	Change Cipher Spec, Encrypted Handshake Message
2369	5.990469	34.254.143.3	192.168.178.64	TLSv1.2	105	Change Cipher Spec, Encrypted Handshake Message
2366	5.988185	34.254.143.3	192.168.178.64	TLSv1.2	105	Change Cipher Spec, Encrypted Handshake Message
3724	11.154685	185.235.86.5	192.168.178.64	TLSv1.3	104	Application Data
2099	5.461547	3.124.64.248	192.168.178.64	TLSv1.3	102	Application Data
932	3.102112	52.219.72.215	192.168.178.64	TLSv1.3	101	Application Data
641	1.812720	52.219.72.215	192.168.178.64	TLSv1.3	101	Application Data
3950	14.024748	46.228.174.117	192.168.178.64	TLSv1.2	100	Application Data
2997	8.765284	217.79.188.60	192.168.178.64	TLSv1.3	97	Application Data
2360	5.958571	18.159.188.190	192.168.178.64	TLSv1.2	96	Application Data
2326	5.883611	37.252.171.85	192.168.178.64	TLSv1.2	96	Application Data
2248	5.541042	37.252.171.85	192.168.178.64	TLSv1.2	96	Application Data
2113	5.470196	37.252.171.85	192.168.178.64	TLSv1.2	96	Application Data
1987	5.426804	3.124.64.248	192.168.178.64	TLSv1.3	95	Application Data
3843	11.637444	217.79.188.60	192.168.178.64	TLSv1.3	93	Application Data
3827	11.538100	217.79.188.60	192.168.178.64	TLSv1.3	93	Application Data
3767	11.382404	35.214.136.108	192.168.178.64	TLSv1.2	93	Application Data
3609	11.028371	35.214.136.108	192.168.178.64	TLSv1.2	93	Application Data
2758	7.863398	141.95.33.120	192.168.178.64	TLSv1.3	93	Application Data
4	0.586607	104.18.25.18	192.168.178.64	TLSv1.2	93	Application Data
3355	10.162854	184.28.88.244	192.168.178.64	TLSv1.2	92	Application Data
2306	5.803391	34.242.52.142	192.168.178.64	TLSv1.2	92	Application Data
2189	5.506813	34.254.237.109	192.168.178.64	TLSv1.2	92	Application Data
2112	5.470196	37.252.171.85	192.168.178.64	TLSv1.2	92	Application Data
1620	4.646430	34.242.52.142	192.168.178.64	TLSv1.2	92	Application Data
2225	5.522759	35.210.58.154	192.168.178.64	TLSv1.3	89	Application Data
2218	5.520074	35.210.58.154	192.168.178.64	TLSv1.3	89	Application Data
2155	5.497564	35.210.58.154	192.168.178.64	TLSv1.3	89	Application Data
2151	5.497564	35.210.58.154	192.168.178.64	TLSv1.3	89	Application Data
2139	5.476060	35.210.58.154	192.168.178.64	TLSv1.3	89	Application Data
2137	5.476060	35.210.58.154	192.168.178.64	TLSv1.3	89	Application Data
2136	5.476060	35.210.58.154	192.168.178.64	TLSv1.3	89	Application Data
2088	5.456298	35.210.58.154	192.168.178.64	TLSv1.3	89	Application Data
2085	5.456298	35.210.58.154	192.168.178.64	TLSv1.3	89	Application Data
2078	5.454888	35.210.58.154	192.168.178.64	TLSv1.3	89	Application Data
2075	5.454888	35.210.58.154	192.168.178.64	TLSv1.3	89	Application Data
1907	5.398174	37.157.6.237	192.168.178.64	TLSv1.2	89	Application Data
3954	14.025656	46.228.174.117	192.168.178.64	TLSv1.2	85	Encrypted Alert
3754	11.368391	76.223.111.18	192.168.178.64	TLSv1.2	85	Application Data
3661	11.070855	35.210.58.154	192.168.178.64	TLSv1.3	85	Application Data
3471	10.804217	52.50.128.177	192.168.178.64	TLSv1.2	85	Application Data
3241	9.880935	63.140.62.17	192.168.178.64	TLSv1.3	85	Application Data
3179	9.558800	54.77.230.99	192.168.178.64	TLSv1.3	85	Application Data
3099	9.120106	54.77.230.99	192.168.178.64	TLSv1.3	85	Application Data
3016	8.841786	63.140.62.17	192.168.178.64	TLSv1.3	85	Application Data
2998	8.765284	217.79.188.60	192.168.178.64	TLSv1.3	85	Application Data
2405	6.280270	108.138.38.29	192.168.178.64	TLSv1.2	85	Application Data
2400	6.244945	2.23.209.164	192.168.178.64	TLSv1.2	85	Application Data
2392	6.151965	216.200.232.249	192.168.178.64	TLSv1.2	85	Encrypted Alert
2272	5.562246	35.210.58.154	192.168.178.64	TLSv1.3	85	Application Data
2268	5.559887	35.210.58.154	192.168.178.64	TLSv1.3	85	Application Data
2263	5.553487	35.210.58.154	192.168.178.64	TLSv1.3	85	Application Data
2258	5.548975	35.210.58.154	192.168.178.64	TLSv1.3	85	Application Data
2253	5.543584	35.210.58.154	192.168.178.64	TLSv1.3	85	Application Data
2238	5.528378	35.210.58.154	192.168.178.64	TLSv1.3	85	Application Data
2213	5.515503	35.210.58.154	192.168.178.64	TLSv1.3	85	Application Data
2192	5.506813	35.210.58.154	192.168.178.64	TLSv1.3	85	Application Data
2185	5.500606	35.210.58.154	192.168.178.64	TLSv1.3	85	Application Data
2073	5.453599	35.210.58.154	192.168.178.64	TLSv1.3	85	Application Data
1859	5.238497	63.140.62.27	192.168.178.64	TLSv1.3	85	Application Data
1636	4.652577	63.35.45.179	192.168.178.64	TLSv1.2	85	Application Data
1490	4.305544	63.140.62.27	192.168.178.64	TLSv1.3	85	Application Data
1483	4.298444	63.140.62.27	192.168.178.64	TLSv1.3	85	Application Data
1251	4.000029	63.140.62.17	192.168.178.64	TLSv1.3	85	Application Data
1002	3.775969	63.140.62.17	192.168.178.64	TLSv1.3	85	Application Data
431	1.759925	52.85.67.113	192.168.178.64	TLSv1.3	85	Application Data
103	1.583992	2.23.209.144	192.168.178.64	TLSv1.3	85	Application Data
3959	14.311578	136.243.25.87	192.168.178.64	TLSv1.3	78	Application Data
3844	11.637444	217.79.188.60	192.168.178.64	TLSv1.3	78	Application Data
3828	11.538100	217.79.188.60	192.168.178.64	TLSv1.3	78	Application Data
2952	8.615147	52.219.72.215	192.168.178.64	TLSv1.3	78	Application Data
2759	7.863398	141.95.33.120	192.168.178.64	TLSv1.3	78	Application Data
2731	7.614658	52.219.72.215	192.168.178.64	TLSv1.3	78	Application Data
3936	13.199473	23.213.161.14	192.168.178.64	TCP	66	[TCP Retransmission] 443 → 59685 [SYN, ACK] Seq=0 Ack=1 Win=64240 Len=0 MSS=1384 SACK_PERM WS=128
3920	11.886725	217.79.188.60	192.168.178.64	TCP	66	[TCP Retransmission] 443 → 59679 [SYN, ACK] Seq=0 Ack=1 Win=64240 Len=0 MSS=1460 SACK_PERM WS=128
3886	11.717388	184.28.88.119	192.168.178.64	TCP	66	443 → 59692 [SYN, ACK] Seq=0 Ack=1 Win=64240 Len=0 MSS=1452 SACK_PERM WS=128
3739	11.247629	184.28.88.119	192.168.178.64	TCP	66	[TCP Keep-Alive ACK] 443 → 59640 [ACK] Seq=1 Ack=2 Win=501 Len=0 SLE=1 SRE=2
3721	11.149975	23.213.161.14	192.168.178.64	TCP	66	[TCP Retransmission] 443 → 59685 [SYN, ACK] Seq=0 Ack=1 Win=64240 Len=0 MSS=1384 SACK_PERM WS=128
3702	11.102653	185.235.86.81	192.168.178.64	TCP	66	443 → 59691 [SYN, ACK] Seq=0 Ack=1 Win=64240 Len=0 MSS=1452 SACK_PERM WS=1024
3698	11.101144	185.235.86.5	192.168.178.64	TCP	66	443 → 59690 [SYN, ACK] Seq=0 Ack=1 Win=64240 Len=0 MSS=1452 SACK_PERM WS=1024
3649	11.062574	69.173.144.165	192.168.178.64	TCP	66	443 → 59689 [SYN, ACK] Seq=0 Ack=1 Win=14600 Len=0 MSS=1452 WS=4 SACK_PERM
3415	10.522798	46.228.174.117	192.168.178.64	TCP	66	443 → 59688 [SYN, ACK] Seq=0 Ack=1 Win=65535 Len=0 MSS=1452 SACK_PERM WS=16384
3332	10.136357	184.28.88.244	192.168.178.64	TCP	66	443 → 59687 [SYN, ACK] Seq=0 Ack=1 Win=64240 Len=0 MSS=1452 SACK_PERM WS=128
3322	10.130820	23.213.161.14	192.168.178.64	TCP	66	443 → 59686 [SYN, ACK] Seq=0 Ack=1 Win=64240 Len=0 MSS=1384 SACK_PERM WS=128
3319	10.129731	23.213.161.14	192.168.178.64	TCP	66	443 → 59685 [SYN, ACK] Seq=0 Ack=1 Win=64240 Len=0 MSS=1384 SACK_PERM WS=128
3238	9.874572	217.79.188.60	192.168.178.64	TCP	66	[TCP Retransmission] 443 → 59679 [SYN, ACK] Seq=0 Ack=1 Win=64240 Len=0 MSS=1460 SACK_PERM WS=128
3120	9.171071	136.243.25.87	192.168.178.64	TCP	66	443 → 59684 [SYN, ACK] Seq=0 Ack=1 Win=64240 Len=0 MSS=1452 SACK_PERM WS=128
3117	9.165179	136.243.25.87	192.168.178.64	TCP	66	443 → 59683 [SYN, ACK] Seq=0 Ack=1 Win=64240 Len=0 MSS=1452 SACK_PERM WS=128
3064	9.019770	54.77.230.99	192.168.178.64	TCP	66	443 → 59682 [SYN, ACK] Seq=0 Ack=1 Win=26883 Len=0 MSS=1452 SACK_PERM WS=256
3055	8.993954	217.79.188.60	192.168.178.64	TCP	66	443 → 59681 [SYN, ACK] Seq=0 Ack=1 Win=64240 Len=0 MSS=1452 SACK_PERM WS=128
3025	8.915384	217.79.188.60	192.168.178.64	TCP	66	443 → 59680 [SYN, ACK] Seq=0 Ack=1 Win=64240 Len=0 MSS=1452 SACK_PERM WS=128
3019	8.863732	217.79.188.60	192.168.178.64	TCP	66	443 → 59679 [SYN, ACK] Seq=0 Ack=1 Win=64240 Len=0 MSS=1452 SACK_PERM WS=128
2979	8.722048	217.79.188.60	192.168.178.64	TCP	66	443 → 59678 [SYN, ACK] Seq=0 Ack=1 Win=64240 Len=0 MSS=1452 SACK_PERM WS=128
2422	6.362810	52.95.126.160	192.168.178.64	TCP	66	443 → 59674 [SYN, ACK] Seq=0 Ack=1 Win=8190 Len=0 MSS=1440 WS=64 SACK_PERM
2420	6.361577	52.95.126.160	192.168.178.64	TCP	66	443 → 59673 [SYN, ACK] Seq=0 Ack=1 Win=8190 Len=0 MSS=1440 WS=64 SACK_PERM
2330	5.899166	34.254.143.3	192.168.178.64	TCP	66	443 → 59672 [SYN, ACK] Seq=0 Ack=1 Win=26883 Len=0 MSS=1452 SACK_PERM WS=128
2328	5.898167	34.254.143.3	192.168.178.64	TCP	66	443 → 59671 [SYN, ACK] Seq=0 Ack=1 Win=26883 Len=0 MSS=1452 SACK_PERM WS=128
1924	5.404605	3.124.64.248	192.168.178.64	TCP	66	443 → 59670 [SYN, ACK] Seq=0 Ack=1 Win=26883 Len=0 MSS=1452 SACK_PERM WS=4096
1898	5.393683	35.210.58.154	192.168.178.64	TCP	66	443 → 59667 [SYN, ACK] Seq=0 Ack=1 Win=42600 Len=0 MSS=1420 SACK_PERM WS=128
1450	4.208524	63.140.62.27	192.168.178.64	TCP	66	443 → 59657 [SYN, ACK] Seq=0 Ack=1 Win=62727 Len=0 MSS=1452 SACK_PERM WS=128
977	3.674370	63.140.62.17	192.168.178.64	TCP	66	443 → 59655 [SYN, ACK] Seq=0 Ack=1 Win=62727 Len=0 MSS=1452 SACK_PERM WS=128
925	3.083087	52.219.72.215	192.168.178.64	TCP	66	443 → 59654 [SYN, ACK] Seq=0 Ack=1 Win=65535 Len=0 MSS=1432 WS=256 SACK_PERM
744	1.845196	141.95.33.120	192.168.178.64	TCP	66	[TCP Dup ACK 675#1] 443 → 59652 [ACK] Seq=1 Ack=1 Win=42496 Len=0 SLE=1453 SRE=1898
675	1.820566	141.95.33.120	192.168.178.64	TCP	66	443 → 59652 [SYN, ACK] Seq=0 Ack=1 Win=42340 Len=0 MSS=1452 SACK_PERM WS=512
552	1.775756	52.219.72.215	192.168.178.64	TCP	66	443 → 59650 [SYN, ACK] Seq=0 Ack=1 Win=65535 Len=0 MSS=1432 WS=256 SACK_PERM
259	1.722392	52.85.67.113	192.168.178.64	TCP	66	443 → 59647 [SYN, ACK] Seq=0 Ack=1 Win=65535 Len=0 MSS=1440 SACK_PERM WS=512
58	1.554704	2.23.209.144	192.168.178.64	TCP	66	443 → 59644 [SYN, ACK] Seq=0 Ack=1 Win=64240 Len=0 MSS=1384 SACK_PERM WS=128
13	1.230911	184.28.88.119	192.168.178.64	TCP	66	443 → 59454 [ACK] Seq=1 Ack=2 Win=501 Len=0 SLE=1 SRE=2
12	1.230911	184.28.88.119	192.168.178.64	TCP	66	443 → 59640 [ACK] Seq=1 Ack=2 Win=501 Len=0 SLE=1 SRE=2
11	1.229695	184.28.88.119	192.168.178.64	TCP	66	443 → 59456 [ACK] Seq=1 Ack=2 Win=501 Len=0 SLE=1 SRE=2
3897	11.744603	184.28.88.119	192.168.178.64	TCP	60	443 → 59692 [ACK] Seq=153 Ack=3447 Win=64128 Len=0
3896	11.744603	184.28.88.119	192.168.178.64	TCP	60	443 → 59692 [ACK] Seq=153 Ack=2160 Win=64128 Len=0
3891	11.730792	184.28.88.119	192.168.178.64	TCP	60	443 → 59692 [ACK] Seq=1 Ack=2109 Win=64128 Len=0
3890	11.730792	184.28.88.119	192.168.178.64	TCP	60	443 → 59692 [ACK] Seq=1 Ack=1453 Win=64128 Len=0
3884	11.712783	184.28.88.119	192.168.178.64	TCP	60	443 → 59640 [ACK] Seq=1 Ack=1288 Win=501 Len=0
3868	11.659894	217.79.188.60	192.168.178.64	TCP	60	443 → 59681 [ACK] Seq=6453 Ack=4572 Win=64128 Len=0
3835	11.554113	217.79.188.60	192.168.178.64	TCP	60	443 → 59678 [ACK] Seq=5059 Ack=2727 Win=64128 Len=0
3834	11.554113	217.79.188.60	192.168.178.64	TCP	60	443 → 59678 [ACK] Seq=5059 Ack=2703 Win=64128 Len=0
3778	11.415487	35.214.136.108	192.168.178.64	TCP	60	443 → 59523 [ACK] Seq=1899 Ack=3043 Win=1021 Len=0
3770	11.383730	184.28.88.119	192.168.178.64	TCP	60	443 → 59456 [ACK] Seq=3148 Ack=6534 Win=501 Len=0
3759	11.377356	35.214.136.108	192.168.178.64	TCP	60	443 → 59523 [ACK] Seq=1724 Ack=3004 Win=1021 Len=0
3755	11.368391	184.28.88.119	192.168.178.64	TCP	60	443 → 59454 [ACK] Seq=3277 Ack=7422 Win=501 Len=0
3751	11.367047	37.252.171.85	192.168.178.64	TCP	60	443 → 59668 [ACK] Seq=14707 Ack=48608 Win=53724 Len=0
3749	11.361349	184.28.88.119	192.168.178.64	TCP	60	443 → 59456 [ACK] Seq=2720 Ack=5200 Win=501 Len=0
3735	11.221512	185.235.86.81	192.168.178.64	TCP	60	443 → 59691 [ACK] Seq=718 Ack=3018 Win=64512 Len=0
3733	11.219120	185.235.86.5	192.168.178.64	TCP	60	443 → 59690 [ACK] Seq=755 Ack=3016 Win=64512 Len=0
3727	11.156730	185.235.86.81	192.168.178.64	TCP	60	443 → 59691 [ACK] Seq=243 Ack=2987 Win=64512 Len=0
3715	11.129460	185.235.86.81	192.168.178.64	TCP	60	443 → 59691 [ACK] Seq=1 Ack=2527 Win=64512 Len=0
3713	11.128083	185.235.86.5	192.168.178.64	TCP	60	443 → 59690 [ACK] Seq=1 Ack=2526 Win=64512 Len=0
3666	11.076588	69.173.144.165	192.168.178.64	TCP	60	443 → 59689 [ACK] Seq=1 Ack=1910 Win=23232 Len=0
3658	11.069770	35.210.58.154	192.168.178.64	TCP	60	443 → 59667 [ACK] Seq=21506 Ack=64312 Win=82176 Len=0
3643	11.058672	35.214.136.108	192.168.178.64	TCP	60	443 → 59523 [ACK] Seq=1724 Ack=2296 Win=1023 Len=0
3604	11.025655	35.214.136.108	192.168.178.64	TCP	60	443 → 59523 [ACK] Seq=1549 Ack=2257 Win=1023 Len=0
3585	11.018387	35.214.136.108	192.168.178.64	TCP	60	443 → 59523 [ACK] Seq=1549 Ack=1517 Win=1025 Len=0
3551	10.998193	184.28.88.119	192.168.178.64	TCP	60	443 → 59454 [ACK] Seq=2720 Ack=6100 Win=501 Len=0
3550	10.998193	184.28.88.119	192.168.178.64	TCP	60	443 → 59454 [ACK] Seq=2720 Ack=5354 Win=501 Len=0
3533	10.983552	35.214.136.108	192.168.178.64	TCP	60	443 → 59523 [ACK] Seq=1122 Ack=1478 Win=1025 Len=0
3468	10.662082	46.228.174.117	192.168.178.64	TCP	60	443 → 59688 [ACK] Seq=6934 Ack=2705 Win=81920 Len=0
3460	10.595547	46.228.174.117	192.168.178.64	TCP	60	443 → 59688 [ACK] Seq=6316 Ack=2667 Win=81920 Len=0
3449	10.563632	35.214.136.108	192.168.178.64	TCP	60	443 → 59523 [ACK] Seq=1122 Ack=775 Win=1027 Len=0
3435	10.544197	46.228.174.117	192.168.178.64	TCP	60	443 → 59688 [ACK] Seq=1 Ack=2073 Win=81920 Len=0
3404	10.515298	37.252.171.85	192.168.178.64	TCP	60	443 → 59668 [ACK] Seq=9666 Ack=45422 Win=41249 Len=0
3360	10.216409	184.28.88.244	192.168.178.64	TCP	60	443 → 59687 [ACK] Seq=253 Ack=2282 Win=64128 Len=0
3353	10.162854	184.28.88.244	192.168.178.64	TCP	60	443 → 59687 [ACK] Seq=147 Ack=2244 Win=64128 Len=0
3352	10.162854	184.28.88.244	192.168.178.64	TCP	60	443 → 59687 [ACK] Seq=147 Ack=2145 Win=64128 Len=0
3350	10.160362	104.18.25.18	192.168.178.64	TCP	60	443 → 59509 [ACK] Seq=40 Ack=152 Win=8 Len=0
3349	10.159078	23.213.161.14	192.168.178.64	TCP	60	443 → 59686 [ACK] Seq=271 Ack=2599 Win=64128 Len=0
3345	10.150150	184.28.88.244	192.168.178.64	TCP	60	443 → 59687 [ACK] Seq=1 Ack=2094 Win=64128 Len=0
3344	10.150150	184.28.88.244	192.168.178.64	TCP	60	443 → 59687 [ACK] Seq=1 Ack=1453 Win=64128 Len=0
3340	10.144948	23.213.161.14	192.168.178.64	TCP	60	443 → 59686 [ACK] Seq=1 Ack=1385 Win=64128 Len=0
3307	10.120154	184.28.88.119	192.168.178.64	TCP	60	443 → 59456 [ACK] Seq=864 Ack=3898 Win=501 Len=0
3291	10.108428	184.28.88.119	192.168.178.64	TCP	60	443 → 59454 [ACK] Seq=864 Ack=3902 Win=501 Len=0
3271	10.046630	69.173.144.138	192.168.178.64	TCP	60	[TCP Keep-Alive ACK] 443 → 59530 [ACK] Seq=1 Ack=2 Win=12342 Len=0
3209	9.837174	63.140.62.17	192.168.178.64	TCP	60	443 → 59655 [ACK] Seq=15114 Ack=31671 Win=56576 Len=0
3208	9.836105	63.140.62.17	192.168.178.64	TCP	60	443 → 59655 [ACK] Seq=15114 Ack=29908 Win=56576 Len=0
3207	9.836105	63.140.62.17	192.168.178.64	TCP	60	443 → 59655 [ACK] Seq=15114 Ack=27004 Win=56576 Len=0
3131	9.189060	136.243.25.87	192.168.178.64	TCP	60	443 → 59684 [ACK] Seq=1 Ack=2515 Win=64128 Len=0
3130	9.189060	136.243.25.87	192.168.178.64	TCP	60	443 → 59684 [ACK] Seq=1 Ack=1453 Win=64128 Len=0
3125	9.186952	136.243.25.87	192.168.178.64	TCP	60	443 → 59683 [ACK] Seq=1 Ack=2515 Win=64128 Len=0
3124	9.186952	136.243.25.87	192.168.178.64	TCP	60	443 → 59683 [ACK] Seq=1 Ack=1453 Win=64128 Len=0
3098	9.120106	54.77.230.99	192.168.178.64	TCP	60	443 → 59682 [ACK] Seq=4975 Ack=2860 Win=47872 Len=0
3092	9.118925	54.77.230.99	192.168.178.64	TCP	60	443 → 59682 [ACK] Seq=4734 Ack=2348 Win=45056 Len=0
3091	9.108483	217.79.188.60	192.168.178.64	TCP	60	443 → 59681 [ACK] Seq=6390 Ack=4533 Win=64128 Len=0
3082	9.075116	54.77.230.99	192.168.178.64	TCP	60	443 → 59682 [ACK] Seq=1 Ack=2284 Win=45056 Len=0
3078	9.044973	217.79.188.60	192.168.178.64	TCP	60	443 → 59681 [ACK] Seq=4974 Ack=4502 Win=64128 Len=0
3063	9.017851	217.79.188.60	192.168.178.64	TCP	60	443 → 59681 [ACK] Seq=1 Ack=1906 Win=63488 Len=0
3030	8.939374	217.79.188.60	192.168.178.64	TCP	60	443 → 59680 [ACK] Seq=1 Ack=2461 Win=64128 Len=0
3029	8.939374	217.79.188.60	192.168.178.64	TCP	60	443 → 59680 [ACK] Seq=1 Ack=1453 Win=64128 Len=0
3014	8.825972	217.79.188.60	192.168.178.64	TCP	60	443 → 59678 [ACK] Seq=4996 Ack=2664 Win=64128 Len=0
3013	8.799754	63.140.62.17	192.168.178.64	TCP	60	443 → 59655 [ACK] Seq=14377 Ack=24631 Win=56576 Len=0
3012	8.799754	63.140.62.17	192.168.178.64	TCP	60	443 → 59655 [ACK] Seq=14377 Ack=22863 Win=56576 Len=0
3011	8.799754	63.140.62.17	192.168.178.64	TCP	60	443 → 59655 [ACK] Seq=14377 Ack=19959 Win=56576 Len=0
2987	8.742049	217.79.188.60	192.168.178.64	TCP	60	443 → 59678 [ACK] Seq=1 Ack=2461 Win=63360 Len=0
2986	8.742049	217.79.188.60	192.168.178.64	TCP	60	443 → 59678 [ACK] Seq=1 Ack=1453 Win=64128 Len=0
2955	8.616370	52.219.72.215	192.168.178.64	TCP	60	443 → 59654 [ACK] Seq=6162 Ack=2004 Win=64256 Len=0
2951	8.615147	52.219.72.215	192.168.178.64	TCP	60	443 → 59654 [ACK] Seq=6137 Ack=2003 Win=64256 Len=0
2736	7.625352	3.124.64.248	192.168.178.64	TCP	60	[TCP Keep-Alive] 443 → 59670 [ACK] Seq=5138 Ack=9979 Win=110592 Len=0
2734	7.615729	52.219.72.215	192.168.178.64	TCP	60	443 → 59650 [ACK] Seq=6162 Ack=2004 Win=64256 Len=0
2730	7.614658	52.219.72.215	192.168.178.64	TCP	60	443 → 59650 [ACK] Seq=6137 Ack=2003 Win=64256 Len=0
2512	6.883880	37.252.171.85	192.168.178.64	TCP	60	443 → 59668 [ACK] Seq=9666 Ack=44563 Win=42108 Len=0
2432	6.408383	52.95.126.160	192.168.178.64	TCP	60	443 → 59674 [ACK] Seq=1 Ack=2083 Win=60672 Len=0
2431	6.408383	52.95.126.160	192.168.178.64	TCP	60	443 → 59674 [ACK] Seq=1 Ack=1441 Win=61312 Len=0
2429	6.407104	52.95.126.160	192.168.178.64	TCP	60	[TCP Window Update] 443 → 59674 [ACK] Seq=1 Ack=1 Win=62720 Len=0
2428	6.407104	52.95.126.160	192.168.178.64	TCP	60	443 → 59673 [ACK] Seq=1 Ack=2083 Win=60672 Len=0
2427	6.400336	52.95.126.160	192.168.178.64	TCP	60	[TCP Window Update] 443 → 59673 [ACK] Seq=1 Ack=1 Win=62720 Len=0
2391	6.138423	2.23.209.164	192.168.178.64	TCP	60	443 → 59437 [ACK] Seq=2440 Ack=1447 Win=501 Len=0
2390	6.138423	2.23.209.164	192.168.178.64	TCP	60	443 → 59437 [ACK] Seq=2440 Ack=314 Win=501 Len=0
2386	6.106444	34.254.143.3	192.168.178.64	TCP	60	443 → 59671 [ACK] Seq=4593 Ack=2756 Win=33664 Len=0
2371	6.028708	34.254.143.3	192.168.178.64	TCP	60	443 → 59671 [ACK] Seq=4187 Ack=2718 Win=33664 Len=0
2346	5.947830	34.254.143.3	192.168.178.64	TCP	60	443 → 59672 [ACK] Seq=1 Ack=1905 Win=30720 Len=0
2342	5.946855	34.254.143.3	192.168.178.64	TCP	60	443 → 59671 [ACK] Seq=1 Ack=1905 Win=30720 Len=0
2325	5.883611	37.252.171.85	192.168.178.64	TCP	60	[TCP Window Update] 443 → 59668 [ACK] Seq=3186 Ack=44521 Win=42108 Len=0
2324	5.883611	37.252.171.85	192.168.178.64	TCP	60	[TCP Dup ACK 2323#1] 443 → 59668 [ACK] Seq=3186 Ack=44521 Win=20328 Len=0
2323	5.883611	37.252.171.85	192.168.178.64	TCP	60	443 → 59668 [ACK] Seq=3186 Ack=44521 Win=20328 Len=0
2318	5.865480	37.252.171.85	192.168.178.64	TCP	60	443 → 59668 [ACK] Seq=3186 Ack=27562 Win=23413 Len=0
2302	5.791758	34.242.52.142	192.168.178.64	TCP	60	443 → 59441 [ACK] Seq=1094 Ack=1590 Win=236 Len=0
2285	5.636214	52.85.67.113	192.168.178.64	TCP	60	443 → 59457 [ACK] Seq=1 Ack=369 Win=147 Len=0
2247	5.541042	37.252.171.85	192.168.178.64	TCP	60	443 → 59668 [ACK] Seq=3144 Ack=26110 Win=24865 Len=0
2235	5.525432	35.210.58.154	192.168.178.64	TCP	60	443 → 59667 [ACK] Seq=10977 Ack=62829 Win=79232 Len=0
2234	5.524072	37.252.171.85	192.168.178.64	TCP	60	[TCP Dup ACK 2227#5] 443 → 59668 [ACK] Seq=3144 Ack=18760 Win=32215 Len=0
2233	5.524072	37.252.171.85	192.168.178.64	TCP	60	[TCP Dup ACK 2227#4] 443 → 59668 [ACK] Seq=3144 Ack=18760 Win=32215 Len=0
2232	5.524072	37.252.171.85	192.168.178.64	TCP	60	[TCP Dup ACK 2227#3] 443 → 59668 [ACK] Seq=3144 Ack=18760 Win=32215 Len=0
2229	5.522759	37.252.171.85	192.168.178.64	TCP	60	[TCP Dup ACK 2227#2] 443 → 59668 [ACK] Seq=3144 Ack=18760 Win=32215 Len=0
2228	5.522759	37.252.171.85	192.168.178.64	TCP	60	[TCP Dup ACK 2227#1] 443 → 59668 [ACK] Seq=3144 Ack=18760 Win=32215 Len=0
2227	5.522759	37.252.171.85	192.168.178.64	TCP	60	443 → 59668 [ACK] Seq=3144 Ack=18760 Win=32215 Len=0
2226	5.522759	35.210.58.154	192.168.178.64	TCP	60	443 → 59667 [ACK] Seq=10977 Ack=60386 Win=73600 Len=0
2223	5.521553	35.210.58.154	192.168.178.64	TCP	60	443 → 59667 [ACK] Seq=10942 Ack=56126 Win=65024 Len=0
2219	5.520074	35.210.58.154	192.168.178.64	TCP	60	443 → 59667 [ACK] Seq=9187 Ack=50446 Win=53632 Len=0
2217	5.516363	3.124.64.248	192.168.178.64	TCP	60	443 → 59670 [ACK] Seq=4450 Ack=9979 Win=110592 Len=0
2169	5.497564	37.252.171.85	192.168.178.64	TCP	60	[TCP Dup ACK 2168#1] 443 → 59668 [ACK] Seq=3089 Ack=15095 Win=35880 Len=0
2168	5.497564	37.252.171.85	192.168.178.64	TCP	60	443 → 59668 [ACK] Seq=3089 Ack=15095 Win=35880 Len=0
2167	5.497564	37.252.171.85	192.168.178.64	TCP	60	[TCP Dup ACK 2120#18] 443 → 59668 [ACK] Seq=3089 Ack=9880 Win=41095 Len=0
2166	5.497564	37.252.171.85	192.168.178.64	TCP	60	[TCP Dup ACK 2120#17] 443 → 59668 [ACK] Seq=3089 Ack=9880 Win=41095 Len=0
2165	5.497564	37.252.171.85	192.168.178.64	TCP	60	[TCP Dup ACK 2120#16] 443 → 59668 [ACK] Seq=3089 Ack=9880 Win=41095 Len=0
2164	5.497564	37.252.171.85	192.168.178.64	TCP	60	[TCP Dup ACK 2120#15] 443 → 59668 [ACK] Seq=3089 Ack=9880 Win=41095 Len=0
2163	5.497564	37.252.171.85	192.168.178.64	TCP	60	[TCP Dup ACK 2120#14] 443 → 59668 [ACK] Seq=3089 Ack=9880 Win=41095 Len=0
2162	5.497564	37.252.171.85	192.168.178.64	TCP	60	[TCP Dup ACK 2120#13] 443 → 59668 [ACK] Seq=3089 Ack=9880 Win=41095 Len=0
2161	5.497564	37.252.171.85	192.168.178.64	TCP	60	[TCP Dup ACK 2120#12] 443 → 59668 [ACK] Seq=3089 Ack=9880 Win=41095 Len=0
2160	5.497564	37.252.171.85	192.168.178.64	TCP	60	[TCP Dup ACK 2120#11] 443 → 59668 [ACK] Seq=3089 Ack=9880 Win=41095 Len=0
2159	5.497564	37.252.171.85	192.168.178.64	TCP	60	[TCP Dup ACK 2120#10] 443 → 59668 [ACK] Seq=3089 Ack=9880 Win=41095 Len=0
2158	5.497564	37.252.171.85	192.168.178.64	TCP	60	[TCP Dup ACK 2120#9] 443 → 59668 [ACK] Seq=3089 Ack=9880 Win=41095 Len=0
2156	5.497564	35.210.58.154	192.168.178.64	TCP	60	443 → 59667 [ACK] Seq=3720 Ack=44766 Win=42368 Len=0
2154	5.497564	35.210.58.154	192.168.178.64	TCP	60	443 → 59667 [ACK] Seq=3685 Ack=41926 Win=36736 Len=0
2153	5.497564	35.210.58.154	192.168.178.64	TCP	60	443 → 59667 [ACK] Seq=3685 Ack=39086 Win=36096 Len=0
2152	5.497564	35.210.58.154	192.168.178.64	TCP	60	443 → 59667 [ACK] Seq=3685 Ack=34826 Win=37888 Len=0
2150	5.497564	35.210.58.154	192.168.178.64	TCP	60	443 → 59667 [ACK] Seq=3650 Ack=30566 Win=36736 Len=0
2149	5.497564	35.210.58.154	192.168.178.64	TCP	60	443 → 59667 [ACK] Seq=3650 Ack=27726 Win=37888 Len=0
2138	5.476060	35.210.58.154	192.168.178.64	TCP	60	443 → 59667 [ACK] Seq=3615 Ack=23466 Win=37888 Len=0
2134	5.475456	35.210.58.154	192.168.178.64	TCP	60	443 → 59667 [ACK] Seq=3545 Ack=19206 Win=36736 Len=0
2132	5.473933	37.252.171.85	192.168.178.64	TCP	60	[TCP Dup ACK 2120#8] 443 → 59668 [ACK] Seq=3089 Ack=9880 Win=41095 Len=0
2131	5.473933	37.252.171.85	192.168.178.64	TCP	60	[TCP Dup ACK 2120#7] 443 → 59668 [ACK] Seq=3089 Ack=9880 Win=41095 Len=0
2130	5.473933	37.252.171.85	192.168.178.64	TCP	60	[TCP Dup ACK 2120#6] 443 → 59668 [ACK] Seq=3089 Ack=9880 Win=41095 Len=0
2126	5.472623	37.252.171.85	192.168.178.64	TCP	60	[TCP Dup ACK 2120#5] 443 → 59668 [ACK] Seq=3089 Ack=9880 Win=41095 Len=0
2125	5.472623	37.252.171.85	192.168.178.64	TCP	60	[TCP Dup ACK 2120#4] 443 → 59668 [ACK] Seq=3089 Ack=9880 Win=41095 Len=0
2124	5.472623	37.252.171.85	192.168.178.64	TCP	60	[TCP Dup ACK 2120#3] 443 → 59668 [ACK] Seq=3089 Ack=9880 Win=41095 Len=0
2123	5.472623	37.252.171.85	192.168.178.64	TCP	60	[TCP Dup ACK 2120#2] 443 → 59668 [ACK] Seq=3089 Ack=9880 Win=41095 Len=0
2122	5.472623	37.252.171.85	192.168.178.64	TCP	60	[TCP Dup ACK 2120#1] 443 → 59668 [ACK] Seq=3089 Ack=9880 Win=41095 Len=0
2120	5.471249	37.252.171.85	192.168.178.64	TCP	60	443 → 59668 [ACK] Seq=3089 Ack=9880 Win=41095 Len=0
2119	5.471249	37.252.171.85	192.168.178.64	TCP	60	443 → 59668 [ACK] Seq=3089 Ack=8428 Win=41095 Len=0
2114	5.470196	37.252.171.85	192.168.178.64	TCP	60	443 → 59668 [ACK] Seq=3089 Ack=5524 Win=41095 Len=0
2108	5.467557	184.28.88.119	192.168.178.64	TCP	60	443 → 59456 [ACK] Seq=1 Ack=2573 Win=501 Len=0
2107	5.467557	184.28.88.119	192.168.178.64	TCP	60	443 → 59456 [ACK] Seq=1 Ack=1454 Win=501 Len=0
2098	5.461547	3.124.64.248	192.168.178.64	TCP	60	443 → 59670 [ACK] Seq=4402 Ack=9948 Win=110592 Len=0
2097	5.460199	3.124.64.248	192.168.178.64	TCP	60	443 → 59670 [ACK] Seq=4402 Ack=7403 Win=90112 Len=0
2096	5.458866	3.124.64.248	192.168.178.64	TCP	60	443 → 59670 [ACK] Seq=4402 Ack=4499 Win=53248 Len=0
2093	5.456298	184.28.88.119	192.168.178.64	TCP	60	443 → 59454 [ACK] Seq=1 Ack=2577 Win=501 Len=0
2092	5.456298	184.28.88.119	192.168.178.64	TCP	60	443 → 59454 [ACK] Seq=1 Ack=1454 Win=501 Len=0
2090	5.456298	3.124.64.248	192.168.178.64	TCP	60	443 → 59670 [ACK] Seq=4338 Ack=2055 Win=45056 Len=0
2089	5.456298	35.210.58.154	192.168.178.64	TCP	60	443 → 59667 [ACK] Seq=3545 Ack=16366 Win=37888 Len=0
2087	5.456298	35.210.58.154	192.168.178.64	TCP	60	443 → 59667 [ACK] Seq=3510 Ack=14750 Win=37120 Len=0
2086	5.456298	35.210.58.154	192.168.178.64	TCP	60	443 → 59667 [ACK] Seq=3510 Ack=12694 Win=37888 Len=0
2084	5.456298	35.210.58.154	192.168.178.64	TCP	60	443 → 59667 [ACK] Seq=3475 Ack=11078 Win=37888 Len=0
2083	5.456298	35.210.58.154	192.168.178.64	TCP	60	443 → 59667 [ACK] Seq=3475 Ack=8924 Win=37888 Len=0
2077	5.454888	35.210.58.154	192.168.178.64	TCP	60	443 → 59667 [ACK] Seq=3440 Ack=7308 Win=37120 Len=0
2076	5.454888	35.210.58.154	192.168.178.64	TCP	60	443 → 59667 [ACK] Seq=3440 Ack=5224 Win=37888 Len=0
2052	5.450089	3.124.64.248	192.168.178.64	TCP	60	443 → 59670 [ACK] Seq=4338 Ack=1963 Win=45056 Len=0
1999	5.427475	37.252.171.85	192.168.178.64	TCP	60	443 → 59668 [ACK] Seq=1 Ack=2106 Win=41095 Len=0
1998	5.427475	37.252.171.85	192.168.178.64	TCP	60	443 → 59668 [ACK] Seq=1 Ack=1453 Win=41748 Len=0
1986	5.426804	3.124.64.248	192.168.178.64	TLSv1.3	60	Change Cipher Spec
1984	5.426804	3.124.64.248	192.168.178.64	TCP	60	443 → 59670 [ACK] Seq=1 Ack=1899 Win=45056 Len=0
1959	5.419971	35.210.58.154	192.168.178.64	TCP	60	443 → 59667 [ACK] Seq=1 Ack=1902 Win=40704 Len=0
1921	5.402457	2.23.209.164	192.168.178.64	TCP	60	443 → 59437 [ACK] Seq=2440 Ack=237 Win=501 Len=0
1920	5.402457	2.23.209.164	192.168.178.64	TCP	60	443 → 59437 [ACK] Seq=2440 Ack=202 Win=501 Len=0
1856	5.202882	63.140.62.27	192.168.178.64	TCP	60	443 → 59657 [ACK] Seq=4934 Ack=11894 Win=56576 Len=0
1473	4.271251	63.140.62.27	192.168.178.64	TCP	60	443 → 59657 [ACK] Seq=3632 Ack=9485 Win=56576 Len=0
1472	4.270251	63.140.62.27	192.168.178.64	TCP	60	443 → 59657 [ACK] Seq=3632 Ack=4596 Win=58368 Len=0
1470	4.270251	63.140.62.27	192.168.178.64	TCP	60	443 → 59657 [ACK] Seq=3105 Ack=2062 Win=60800 Len=0
1459	4.238015	63.140.62.27	192.168.178.64	TCP	60	443 → 59657 [ACK] Seq=1 Ack=1906 Win=60928 Len=0
1036	3.957892	63.140.62.17	192.168.178.64	TCP	60	443 → 59655 [ACK] Seq=13856 Ack=17587 Win=56576 Len=0
1035	3.956926	63.140.62.17	192.168.178.64	TCP	60	443 → 59655 [ACK] Seq=13856 Ack=14507 Win=56576 Len=0
1034	3.956926	63.140.62.17	192.168.178.64	TCP	60	443 → 59655 [ACK] Seq=13856 Ack=11603 Win=56576 Len=0
992	3.737071	63.140.62.17	192.168.178.64	TCP	60	443 → 59655 [ACK] Seq=3667 Ack=9197 Win=56576 Len=0
990	3.735934	63.140.62.17	192.168.178.64	TCP	60	443 → 59655 [ACK] Seq=3140 Ack=3509 Win=59392 Len=0
981	3.707466	63.140.62.17	192.168.178.64	TCP	60	443 → 59655 [ACK] Seq=1 Ack=1901 Win=60928 Len=0
980	3.707466	63.140.62.17	192.168.178.64	TCP	60	443 → 59655 [ACK] Seq=1 Ack=1453 Win=61312 Len=0
972	3.515954	52.85.65.72	192.168.178.64	TCP	60	443 → 59382 [ACK] Seq=636 Ack=2607 Win=228 Len=0
944	3.121417	52.219.72.215	192.168.178.64	TCP	60	443 → 59654 [ACK] Seq=6137 Ack=1979 Win=64256 Len=0
931	3.102112	52.219.72.215	192.168.178.64	TLSv1.3	60	Change Cipher Spec
929	3.102112	52.219.72.215	192.168.178.64	TCP	60	443 → 59654 [ACK] Seq=1 Ack=1915 Win=64000 Len=0
928	3.102112	52.219.72.215	192.168.178.64	TCP	60	443 → 59654 [ACK] Seq=1 Ack=1433 Win=64256 Len=0
865	1.923407	141.95.33.120	192.168.178.64	TCP	60	443 → 59652 [ACK] Seq=2614 Ack=2085 Win=42496 Len=0
745	1.845196	141.95.33.120	192.168.178.64	TCP	60	443 → 59652 [ACK] Seq=1 Ack=1898 Win=41984 Len=0
720	1.836898	52.219.72.215	192.168.178.64	TCP	60	443 → 59650 [ACK] Seq=6137 Ack=1979 Win=64256 Len=0
671	1.819271	52.85.67.113	192.168.178.64	TCP	60	443 → 59647 [ACK] Seq=5108 Ack=2094 Win=69632 Len=0
640	1.812720	52.219.72.215	192.168.178.64	TLSv1.3	60	Change Cipher Spec
637	1.811900	52.219.72.215	192.168.178.64	TCP	60	443 → 59650 [ACK] Seq=1 Ack=1915 Win=64000 Len=0
636	1.811900	52.219.72.215	192.168.178.64	TCP	60	443 → 59650 [ACK] Seq=1 Ack=1433 Win=64256 Len=0
428	1.759925	52.85.67.113	192.168.178.64	TCP	60	443 → 59647 [ACK] Seq=4836 Ack=1971 Win=69632 Len=0
301	1.738529	52.85.67.113	192.168.178.64	TCP	60	443 → 59647 [ACK] Seq=1 Ack=1907 Win=69632 Len=0
120	1.638718	2.23.209.144	192.168.178.64	TCP	60	443 → 59644 [ACK] Seq=644 Ack=2728 Win=64128 Len=0
101	1.583992	2.23.209.144	192.168.178.64	TCP	60	443 → 59644 [ACK] Seq=552 Ack=2697 Win=64128 Len=0
99	1.582551	2.23.209.144	192.168.178.64	TCP	60	443 → 59644 [ACK] Seq=265 Ack=2605 Win=64128 Len=0
76	1.569006	2.23.209.144	192.168.178.64	TCP	60	443 → 59644 [ACK] Seq=1 Ack=1385 Win=64128 Len=0
15	1.346981	69.173.144.165	192.168.178.64	TCP	60	443 → 59542 [ACK] Seq=1 Ack=2 Win=15972 Len=0
2	0.020896	69.173.144.138	192.168.178.64	TCP	60	443 → 59530 [ACK] Seq=1 Ack=2 Win=12342 Len=0
1922	5.403700	37.252.171.85	192.168.178.64	TCP	58	443 → 59668 [SYN, ACK] Seq=0 Ack=1 Win=42340 Len=0 MSS=1452
3958	14.045505	46.228.174.117	192.168.178.64	TCP	54	443 → 59688 [RST] Seq=7201 Win=0 Len=0
3957	14.044633	46.228.174.117	192.168.178.64	TCP	54	443 → 59688 [RST] Seq=7201 Win=0 Len=0
3956	14.044633	46.228.174.117	192.168.178.64	TCP	54	443 → 59688 [RST] Seq=7201 Win=0 Len=0
3879	11.683624	217.79.188.60	192.168.178.64	TCP	54	443 → 59681 [RST] Seq=6454 Win=0 Len=0
3871	11.660984	217.79.188.60	192.168.178.64	TCP	54	443 → 59681 [RST] Seq=6453 Win=0 Len=0
3870	11.660984	217.79.188.60	192.168.178.64	TCP	54	443 → 59681 [RST] Seq=6453 Win=0 Len=0
3869	11.660984	217.79.188.60	192.168.178.64	TCP	54	443 → 59681 [FIN, ACK] Seq=6453 Ack=4572 Win=64128 Len=0
3838	11.555080	217.79.188.60	192.168.178.64	TCP	54	443 → 59678 [RST] Seq=5059 Win=0 Len=0
3837	11.555080	217.79.188.60	192.168.178.64	TCP	54	443 → 59678 [RST, ACK] Seq=5060 Ack=2727 Win=64128 Len=0
3836	11.555080	217.79.188.60	192.168.178.64	TCP	54	443 → 59678 [FIN, ACK] Seq=5059 Ack=2727 Win=64128 Len=0
3041	8.966648	217.79.188.60	192.168.178.64	TCP	54	443 → 59680 [FIN, ACK] Seq=4412 Ack=2462 Win=64128 Len=0
2957	8.624996	52.219.72.215	192.168.178.64	TCP	54	[TCP Retransmission] 443 → 59654 [FIN, ACK] Seq=6161 Ack=2004 Win=64256 Len=0
2954	8.616370	52.219.72.215	192.168.178.64	TCP	54	443 → 59654 [FIN, ACK] Seq=6161 Ack=2003 Win=64256 Len=0
2773	7.876981	141.95.33.120	192.168.178.64	TCP	54	443 → 59652 [RST] Seq=2678 Win=0 Len=0
2772	7.876981	141.95.33.120	192.168.178.64	TCP	54	443 → 59652 [RST] Seq=2678 Win=0 Len=0
2771	7.876981	141.95.33.120	192.168.178.64	TCP	54	443 → 59652 [RST] Seq=2678 Win=0 Len=0
2760	7.863398	141.95.33.120	192.168.178.64	TCP	54	443 → 59652 [FIN, ACK] Seq=2677 Ack=2085 Win=42496 Len=0
2738	7.631606	52.219.72.215	192.168.178.64	TCP	54	[TCP Retransmission] 443 → 59650 [FIN, ACK] Seq=6161 Ack=2004 Win=64256 Len=0
2732	7.614658	52.219.72.215	192.168.178.64	TCP	54	443 → 59650 [FIN, ACK] Seq=6161 Ack=2003 Win=64256 Len=0
2403	6.273997	216.200.232.249	192.168.178.64	TCP	54	443 → 59429 [RST] Seq=33 Win=0 Len=0
2402	6.273997	216.200.232.249	192.168.178.64	TCP	54	443 → 59429 [RST] Seq=33 Win=0 Len=0
2393	6.151965	216.200.232.249	192.168.178.64	TCP	54	443 → 59429 [FIN, ACK] Seq=32 Ack=1 Win=501 Len=0
2385	6.088540	34.254.143.3	192.168.178.64	TCP	54	443 → 59672 [RST] Seq=4241 Win=0 Len=0
2384	6.088540	34.254.143.3	192.168.178.64	TCP	54	443 → 59672 [RST] Seq=4241 Win=0 Len=0
2378	6.048001	34.254.143.3	192.168.178.64	TCP	54	443 → 59672 [FIN, ACK] Seq=4240 Ack=2147 Win=30720 Len=0
2359	5.958571	18.159.188.190	192.168.178.64	TCP	54	443 → 59464 [ACK] Seq=1 Ack=1697 Win=294 Len=0
2298	5.778631	108.138.38.29	192.168.178.64	TCP	54	443 → 59472 [ACK] Seq=1 Ack=1789 Win=162 Len=0
1943	5.410967	34.254.237.109	192.168.178.64	TCP	54	443 → 59447 [ACK] Seq=1 Ack=2186 Win=294 Len=0
1937	5.405968	52.85.67.113	192.168.178.64	TCP	54	443 → 59457 [ACK] Seq=1 Ack=110 Win=147 Len=0
1914	5.401898	37.157.6.237	192.168.178.64	TCP	54	443 → 59462 [ACK] Seq=36 Ack=8734 Win=63 Len=0
1913	5.401898	37.157.6.237	192.168.178.64	TCP	54	443 → 59462 [ACK] Seq=36 Ack=4596 Win=63 Len=0
1908	5.398174	37.157.6.237	192.168.178.64	TCP	54	443 → 59462 [ACK] Seq=36 Ack=1692 Win=63 Len=0
1894	5.390581	95.101.149.35	192.168.178.64	TCP	54	443 → 59444 [ACK] Seq=1 Ack=2700 Win=488 Len=0
1893	5.390581	95.101.149.35	192.168.178.64	TCP	54	443 → 59444 [ACK] Seq=1 Ack=1695 Win=495 Len=0
1890	5.388346	185.64.189.112	192.168.178.64	TCP	54	443 → 59455 [ACK] Seq=1 Ack=10187 Win=11672 Len=0
1889	5.388346	185.64.189.112	192.168.178.64	TCP	54	443 → 59455 [ACK] Seq=1 Ack=8938 Win=11360 Len=0
1888	5.388346	185.64.189.112	192.168.178.64	TCP	54	443 → 59455 [ACK] Seq=1 Ack=7486 Win=10997 Len=0
1887	5.388346	185.64.189.112	192.168.178.64	TCP	54	443 → 59455 [ACK] Seq=1 Ack=6034 Win=10634 Len=0
1886	5.388346	185.64.189.112	192.168.178.64	TCP	54	443 → 59455 [ACK] Seq=1 Ack=4582 Win=10271 Len=0
1885	5.388283	95.101.149.35	192.168.178.64	TCP	54	443 → 59444 [ACK] Seq=1 Ack=84 Win=501 Len=0
1882	5.383626	185.64.189.112	192.168.178.64	TCP	54	443 → 59455 [ACK] Seq=1 Ack=3130 Win=9908 Len=0
1881	5.383626	185.64.189.112	192.168.178.64	TCP	54	443 → 59455 [ACK] Seq=1 Ack=1678 Win=9545 Len=0
1880	5.383626	185.64.189.112	192.168.178.64	TCP	54	443 → 59455 [ACK] Seq=1 Ack=97 Win=9150 Len=0
1581	4.616869	2.23.209.164	192.168.178.64	TCP	54	443 → 59437 [ACK] Seq=1 Ack=108 Win=501 Len=0
949	3.195612	52.85.65.72	192.168.178.64	TCP	54	443 → 59382 [ACK] Seq=1 Ack=2400 Win=223 Len=0
948	3.189102	52.85.65.72	192.168.178.64	TCP	54	443 → 59382 [ACK] Seq=1 Ack=2070 Win=217 Len=0