2094	5.456406	192.168.178.64	35.210.58.154	TLSv1.3	18514	Application Data, Application Data, Application Data, Application Data, Application Data, Application Data
2145	5.476189	192.168.178.64	35.210.58.154	TLSv1.3	9994	Application Data, Application Data, Application Data, Application Data
2079	5.454936	192.168.178.64	35.210.58.154	TLSv1.3	9994	Application Data, Application Data, Application Data, Application Data, Application Data, Application Data, Application Data
2121	5.471282	192.168.178.64	37.252.171.85	TCP	8766	59668 → 443 [PSH, ACK] Seq=24658 Ack=3089 Win=65112 Len=8712
2063	5.452230	192.168.178.64	37.252.171.85	TLSv1.2	8647	Application Data
1863	5.356118	192.168.178.64	185.64.189.112	TLSv1.2	8563	Application Data
1871	5.370563	192.168.178.64	37.157.6.237	TLSv1.2	7096	Application Data
2033	5.442477	192.168.178.64	3.124.64.248	TLSv1.3	6955	Application Data
2180	5.497972	192.168.178.64	37.252.171.85	TLSv1.2	6849	Application Data, Application Data, Application Data
1025	3.930244	192.168.178.64	63.140.62.17	TLSv1.3	6038	Application Data
2118	5.470267	192.168.178.64	37.252.171.85	TCP	5862	59668 → 443 [ACK] Seq=18850 Ack=3089 Win=65112 Len=5808
2135	5.475512	192.168.178.64	35.210.58.154	TLSv1.3	5734	Application Data, Application Data
2015	5.435235	192.168.178.64	35.210.58.154	TLSv1.3	4903	Application Data
989	3.710674	192.168.178.64	63.140.62.17	TLSv1.3	4821	Application Data
3004	8.772033	192.168.178.64	63.140.62.17	TLSv1.3	4726	Application Data
3199	9.809535	192.168.178.64	63.140.62.17	TLSv1.3	4721	Application Data
2319	5.865562	192.168.178.64	37.252.171.85	TCP	2958	[TCP Retransmission] 59668 → 443 [ACK] Seq=27562 Ack=3186 Win=65015 Len=2904
2039	5.443805	192.168.178.64	184.28.88.119	TLSv1.2	2629	Ignored Unknown Record
2070	5.452931	192.168.178.64	184.28.88.119	TLSv1.2	2625	Ignored Unknown Record
3707	11.104820	192.168.178.64	185.235.86.81	TLSv1.3	2580	Client Hello (SNI=gem.gbc.criteo.com)
3704	11.102993	192.168.178.64	185.235.86.5	TLSv1.3	2579	Client Hello (SNI=ag.gbc.criteo.com)
60	1.556038	192.168.178.64	2.23.209.144	TLSv1.3	2578	Client Hello (SNI=analytics.tiktok.com)
3326	10.131840	192.168.178.64	23.213.161.14	TLSv1.3	2572	Client Hello (SNI=acdn.adnxs.com)
3123	9.172313	192.168.178.64	136.243.25.87	TLSv1.3	2568	Client Hello (SNI=hirsung.de)
3119	9.166478	192.168.178.64	136.243.25.87	TLSv1.3	2568	Client Hello (SNI=hirsung.de)
1469	4.243226	192.168.178.64	63.140.62.27	TLSv1.3	2567	Application Data
3027	8.916505	192.168.178.64	217.79.188.60	TLSv1.3	2514	Client Hello (SNI=imagesrv.adition.com)
2981	8.723449	192.168.178.64	217.79.188.60	TLSv1.3	2514	Client Hello (SNI=imagesrv.adition.com)
3074	9.023268	192.168.178.64	217.79.188.60	TLSv1.3	2478	Application Data
1854	5.175979	192.168.178.64	63.140.62.27	TLSv1.3	2432	Application Data
1466	4.241277	192.168.178.64	63.140.62.27	TLSv1.3	2432	Application Data
1468	4.243186	192.168.178.64	63.140.62.27	TLSv1.3	2430	Application Data
1024	3.930120	192.168.178.64	63.140.62.17	TLSv1.3	2429	Application Data
3198	9.809458	192.168.178.64	63.140.62.17	TLSv1.3	2427	Application Data
988	3.710641	192.168.178.64	63.140.62.17	TLSv1.3	2427	Application Data
3003	8.771969	192.168.178.64	63.140.62.17	TLSv1.3	2426	Application Data
3071	9.022210	192.168.178.64	54.77.230.99	TLSv1.3	2337	Client Hello (SNI=pixel.adsafeprotected.com)
3538	10.986434	192.168.178.64	184.28.88.119	TLSv1.2	2252	Application Data
1865	5.367446	192.168.178.64	34.254.237.109	TLSv1.2	2239	Application Data
3888	11.718646	192.168.178.64	184.28.88.119	TLSv1.2	2162	Client Hello (SNI=ad.yieldlab.net)
1942	5.410247	192.168.178.64	37.252.171.85	TLSv1.2	2159	Client Hello (SNI=ib.adnxs.com)
3334	10.137402	192.168.178.64	184.28.88.244	TLSv1.2	2147	Client Hello (SNI=ads.pubmatic.com)
2066	5.452530	192.168.178.64	37.252.171.85	TLSv1.2	2140	Application Data
2425	6.363920	192.168.178.64	52.95.126.160	TLSv1.3	2136	Client Hello (SNI=aax-eu.amazon-adsystem.com)
2424	6.363118	192.168.178.64	52.95.126.160	TLSv1.3	2136	Client Hello (SNI=aax-eu.amazon-adsystem.com)
2023	5.435835	192.168.178.64	35.210.58.154	TLSv1.3	2133	Application Data
3418	10.524055	192.168.178.64	46.228.174.117	TLSv1.2	2126	Client Hello (SNI=sync.1rx.io)
945	3.174559	192.168.178.64	52.85.65.72	TLSv1.2	2123	Application Data
2069	5.452813	192.168.178.64	37.252.171.85	TLSv1.2	2063	Application Data
2026	5.435955	192.168.178.64	35.210.58.154	TLSv1.3	2035	Application Data
927	3.085283	192.168.178.64	52.219.72.215	TLSv1.3	1968	Client Hello (SNI=s3.eu-central-1.amazonaws.com)
605	1.795091	192.168.178.64	52.219.72.215	TLSv1.3	1968	Client Hello (SNI=s3.eu-central-1.amazonaws.com)
3653	11.063976	192.168.178.64	69.173.144.165	TLSv1.2	1963	Client Hello (SNI=token.rubiconproject.com)
268	1.724205	192.168.178.64	52.85.67.113	TLSv1.3	1960	Client Hello (SNI=c.amazon-adsystem.com)
3058	8.995353	192.168.178.64	217.79.188.60	TLSv1.3	1959	Client Hello (SNI=imagesrv.adition.com)
1452	4.209746	192.168.178.64	63.140.62.27	TLSv1.3	1959	Client Hello (SNI=iqmetrics.spiegel.de)
2333	5.900164	192.168.178.64	34.254.143.3	TLSv1.2	1958	Client Hello (SNI=loadus.exelator.com)
2332	5.899489	192.168.178.64	34.254.143.3	TLSv1.2	1958	Client Hello (SNI=loadus.exelator.com)
1901	5.395155	192.168.178.64	35.210.58.154	TLSv1.3	1955	Client Hello (SNI=orbidder.otto.de)
979	3.675654	192.168.178.64	63.140.62.17	TLSv1.3	1954	Client Hello (SNI=sams.spiegel.de)
1944	5.411061	192.168.178.64	3.124.64.248	TLSv1.3	1952	Client Hello (SNI=tlx.3lift.com)
714	1.833118	192.168.178.64	141.95.33.120	TLSv1.3	1951	Client Hello (SNI=id5-sync.com)
2293	5.758373	192.168.178.64	108.138.38.29	TLSv1.2	1842	Application Data
2340	5.939323	192.168.178.64	18.159.188.190	TLSv1.2	1673	Application Data
2068	5.452755	192.168.178.64	37.252.171.85	TLSv1.2	1672	Application Data
2065	5.452448	192.168.178.64	37.252.171.85	TLSv1.2	1672	Application Data
2028	5.436028	192.168.178.64	35.210.58.154	TLSv1.3	1670	Application Data
2025	5.435917	192.168.178.64	35.210.58.154	TLSv1.3	1670	Application Data
2022	5.435790	192.168.178.64	35.210.58.154	TLSv1.3	1670	Application Data
1869	5.368932	192.168.178.64	95.101.149.35	TLSv1.2	1665	Application Data
1867	5.368371	192.168.178.64	37.157.6.237	TLSv1.2	1664	Application Data
1862	5.355469	192.168.178.64	185.64.189.112	TLSv1.2	1635	Application Data
2288	5.742686	192.168.178.64	34.242.52.142	TLSv1.2	1555	Application Data
3637	11.050549	192.168.178.64	35.210.58.154	TLSv1.3	1537	Application Data
2311	5.847527	192.168.178.64	37.252.171.85	TCP	1506	[TCP Retransmission] 59668 → 443 [ACK] Seq=26110 Ack=3186 Win=65015 Len=1452
2249	5.541132	192.168.178.64	37.252.171.85	TCP	1506	[TCP Retransmission] 59668 → 443 [ACK] Seq=26110 Ack=3144 Win=65057 Len=1452
2230	5.522844	192.168.178.64	37.252.171.85	TLSv1.2	1506	[TCP Fast Retransmission] , Application Data
2178	5.497858	192.168.178.64	37.252.171.85	TCP	1506	[TCP Retransmission] 59668 → 443 [ACK] Seq=15095 Ack=3089 Win=65112 Len=1452
2133	5.473978	192.168.178.64	37.252.171.85	TCP	1506	59668 → 443 [ACK] Seq=36274 Ack=3089 Win=65112 Len=1452 [TCP PDU reassembled in 2180]
2129	5.472710	192.168.178.64	37.252.171.85	TLSv1.2	1506	[TCP Fast Retransmission] , Ignored Unknown Record
2128	5.472694	192.168.178.64	37.252.171.85	TCP	1506	59668 → 443 [ACK] Seq=34822 Ack=3089 Win=65112 Len=1452 [TCP PDU reassembled in 2180]
2127	5.472666	192.168.178.64	37.252.171.85	TCP	1506	59668 → 443 [ACK] Seq=33370 Ack=3089 Win=65112 Len=1452 [TCP PDU reassembled in 2180]
1855	5.176081	192.168.178.64	63.140.62.27	TLSv1.3	1491	Application Data
2029	5.436063	192.168.178.64	35.210.58.154	TCP	1474	59667 → 443 [ACK] Seq=16366 Ack=3154 Win=65280 Len=1420 [TCP PDU reassembled in 2079]
3745	11.349221	192.168.178.64	76.223.111.18	TLSv1.2	1443	Application Data
3544	10.990137	192.168.178.64	76.223.111.18	TLSv1.2	1430	Application Data
2443	6.472817	192.168.178.64	52.95.126.160	TLSv1.3	1396	Application Data
2436	6.410656	192.168.178.64	52.95.126.160	TLSv1.3	1390	Application Data
3758	11.371879	192.168.178.64	184.28.88.119	TLSv1.2	1388	Application Data
3289	10.106317	192.168.178.64	184.28.88.119	TLSv1.2	1379	Application Data
3284	10.094506	192.168.178.64	184.28.88.119	TLSv1.2	1379	Application Data
3748	11.355442	192.168.178.64	184.28.88.119	TLSv1.2	1376	Application Data
3137	9.191569	192.168.178.64	136.243.25.87	TLSv1.3	1361	Application Data
2974	8.704921	192.168.178.64	217.79.188.54	TLSv1.2	1358	Application Data
3534	10.983979	192.168.178.64	69.173.144.138	TLSv1.2	1357	Ignored Unknown Record
3742	11.340440	192.168.178.64	184.28.88.119	TLSv1.2	1356	Application Data
3894	11.732921	192.168.178.64	184.28.88.119	TLSv1.2	1341	Application Data
3881	11.698012	192.168.178.64	184.28.88.119	TLSv1.2	1341	Application Data
3880	11.689951	192.168.178.64	184.28.88.119	TLSv1.2	1341	Application Data
3882	11.700262	192.168.178.64	184.28.88.119	TLSv1.2	1340	Ignored Unknown Record
3849	11.644499	192.168.178.64	184.28.88.119	TLSv1.2	1339	Application Data
3777	11.415338	192.168.178.64	69.173.144.165	TLSv1.2	1294	Application Data
3630	11.044107	192.168.178.64	69.173.144.165	TLSv1.2	1294	Ignored Unknown Record
2388	6.124747	192.168.178.64	2.23.209.164	TLSv1.2	1187	Application Data
2179	5.497946	192.168.178.64	35.210.58.154	TLSv1.3	1077	Application Data, Application Data
1870	5.370502	192.168.178.64	95.101.149.35	TLSv1.2	1059	Application Data
2032	5.442395	192.168.178.64	3.124.64.248	TLSv1.3	1046	Application Data
3381	10.498160	192.168.178.64	37.252.171.85	TLSv1.2	913	Application Data
3162	9.505945	192.168.178.64	54.77.230.99	TLSv1.3	898	Application Data
3537	10.985786	192.168.178.64	37.252.171.85	TLSv1.2	890	Application Data
3469	10.752303	192.168.178.64	52.50.128.177	TLSv1.2	826	Application Data
3424	10.530785	192.168.178.64	54.171.245.237	TLSv1.2	823	Application Data
3313	10.124885	192.168.178.64	52.50.128.177	TLSv1.2	822	Application Data
3743	11.345588	192.168.178.64	37.252.171.85	TLSv1.2	821	Application Data
3652	11.063204	192.168.178.64	37.252.171.85	TLSv1.2	801	Application Data
3558	11.000691	192.168.178.64	35.214.136.108	TLSv1.2	794	Application Data
3389	10.500850	192.168.178.64	35.214.136.108	TLSv1.2	789	Application Data
3823	11.518454	192.168.178.64	37.252.171.85	TLSv1.2	781	Application Data
3762	11.380931	192.168.178.64	37.252.171.85	TLSv1.2	781	Application Data
3747	11.353536	192.168.178.64	37.157.2.14	TLSv1.2	769	Application Data
3732	11.180334	192.168.178.64	37.252.171.85	TLSv1.2	768	Application Data
3561	11.005477	192.168.178.64	185.184.8.90	TLSv1.2	765	Application Data
3535	10.985126	192.168.178.64	37.157.2.14	TLSv1.2	765	Application Data
3741	11.335242	192.168.178.64	35.214.136.108	TLSv1.2	762	Application Data
3374	10.491209	192.168.178.64	185.184.8.90	TLSv1.2	761	Application Data
3502	10.956090	192.168.178.64	35.214.136.108	TLSv1.2	757	Application Data
3362	10.411541	192.168.178.64	76.223.111.18	TLSv1.2	752	Application Data
3203	9.828489	192.168.178.64	76.223.111.18	TLSv1.2	748	Application Data
186	1.676142	192.168.178.64	128.65.210.185	TLSv1.2	734	Application Data
2341	5.939434	192.168.178.64	18.159.188.190	TLSv1.2	703	Application Data
2368	5.989124	192.168.178.64	34.254.143.3	TLSv1.2	642	Application Data
3853	11.650204	192.168.178.64	178.250.1.11	TLSv1.2	537	Application Data
3090	9.079844	192.168.178.64	54.77.230.99	TLSv1.3	474	Application Data
3709	11.105112	192.168.178.64	185.235.86.81	TLSv1.3	424	Application Data
3706	11.103457	192.168.178.64	185.235.86.5	TLSv1.3	423	Application Data
3455	10.575970	192.168.178.64	46.228.174.117	TLSv1.2	423	Application Data
2062	5.452185	192.168.178.64	37.252.171.85	TLSv1.2	376	Application Data
3671	11.077693	192.168.178.64	69.173.144.165	TLSv1.2	372	Client Key Exchange, Change Cipher Spec, Encrypted Handshake Message
2014	5.435185	192.168.178.64	35.210.58.154	TLSv1.3	364	Application Data
947	3.175066	192.168.178.64	52.85.65.72	TLSv1.2	349	Application Data
3498	10.951480	192.168.178.64	178.250.7.13	TLSv1.2	248	Application Data
1573	4.603757	192.168.178.64	63.35.45.179	TLSv1.2	235	Application Data
969	3.502980	192.168.178.64	52.85.65.72	TLSv1.2	226	Application Data
1467	4.241295	192.168.178.64	63.140.62.27	TLSv1.3	210	Application Data
3433	10.540468	192.168.178.64	37.157.2.13	TLSv1.2	203	Application Data
3445	10.554671	192.168.178.64	46.228.174.117	TLSv1.2	180	Client Key Exchange, Change Cipher Spec, Encrypted Handshake Message
2356	5.951468	192.168.178.64	34.254.143.3	TLSv1.2	180	Client Key Exchange, Change Cipher Spec, Encrypted Handshake Message
2354	5.949854	192.168.178.64	34.254.143.3	TLSv1.2	180	Client Key Exchange, Change Cipher Spec, Encrypted Handshake Message
3744	11.347543	192.168.178.64	37.252.171.85	TLSv1.2	176	Application Data
2370	5.991200	192.168.178.64	34.254.143.3	TLSv1.2	170	Application Data
3564	11.006797	192.168.178.64	46.228.174.117	TLSv1.2	166	Application Data
1569	4.601027	192.168.178.64	2.23.209.164	TLSv1.2	161	Application Data
2279	5.620999	192.168.178.64	52.85.67.113	TLSv1.2	159	Application Data
3454	10.575899	192.168.178.64	46.228.174.117	TLSv1.2	153	Application Data
3348	10.151025	192.168.178.64	184.28.88.244	TLSv1.2	153	Application Data
2367	5.989080	192.168.178.64	34.254.143.3	TLSv1.2	153	Application Data
2061	5.452146	192.168.178.64	37.252.171.85	TLSv1.2	153	Application Data
1861	5.355361	192.168.178.64	185.64.189.112	TLSv1.2	150	Application Data
1884	5.387898	192.168.178.64	2.23.209.164	TLSv1.2	148	Application Data
2009	5.434055	192.168.178.64	37.252.171.85	TLSv1.2	147	Client Key Exchange, Change Cipher Spec, Encrypted Handshake Message
3089	9.079808	192.168.178.64	54.77.230.99	TLSv1.3	146	Application Data
3073	9.023233	192.168.178.64	217.79.188.60	TLSv1.3	146	Application Data
2994	8.750082	192.168.178.64	217.79.188.60	TLSv1.3	146	Application Data
2031	5.440202	192.168.178.64	3.124.64.248	TLSv1.3	146	Application Data
2013	5.435152	192.168.178.64	35.210.58.154	TLSv1.3	146	Application Data
1465	4.241244	192.168.178.64	63.140.62.27	TLSv1.3	146	Application Data
987	3.710607	192.168.178.64	63.140.62.17	TLSv1.3	146	Application Data
761	1.850508	192.168.178.64	141.95.33.120	TLSv1.3	146	Application Data
357	1.747100	192.168.178.64	52.85.67.113	TLSv1.3	146	Application Data
84	1.572738	192.168.178.64	2.23.209.144	TLSv1.3	146	Application Data
2082	5.455924	192.168.178.64	37.252.171.85	TLSv1.2	144	Application Data
2067	5.452701	192.168.178.64	37.252.171.85	TLSv1.2	143	Application Data
2064	5.452413	192.168.178.64	37.252.171.85	TLSv1.2	143	Application Data
1571	4.601745	192.168.178.64	34.242.52.142	TLSv1.2	142	Application Data
3718	11.131675	192.168.178.64	185.235.86.81	TLSv1.3	138	Application Data, Application Data
3717	11.130322	192.168.178.64	185.235.86.5	TLSv1.3	138	Application Data, Application Data
2281	5.621601	192.168.178.64	52.85.67.113	TLSv1.2	138	Application Data
1868	5.368892	192.168.178.64	95.101.149.35	TLSv1.2	137	Application Data
1866	5.368304	192.168.178.64	37.157.6.237	TLSv1.2	135	Application Data
3343	10.146899	192.168.178.64	23.213.161.14	TLSv1.3	134	Change Cipher Spec, Application Data
3138	9.191815	192.168.178.64	136.243.25.87	TLSv1.3	134	Change Cipher Spec, Application Data
3136	9.190231	192.168.178.64	136.243.25.87	TLSv1.3	134	Change Cipher Spec, Application Data
3072	9.022603	192.168.178.64	217.79.188.60	TLSv1.3	134	Change Cipher Spec, Application Data
2993	8.749164	192.168.178.64	217.79.188.60	TLSv1.3	134	Change Cipher Spec, Application Data
2006	5.431873	192.168.178.64	35.210.58.154	TLSv1.3	134	Change Cipher Spec, Application Data
83	1.571563	192.168.178.64	2.23.209.144	TLSv1.3	134	Change Cipher Spec, Application Data
3338	10.143851	192.168.178.64	104.18.25.18	TLSv1.2	131	Application Data
2387	6.124639	192.168.178.64	2.23.209.164	TLSv1.2	131	Application Data
2339	5.939281	192.168.178.64	18.159.188.190	TLSv1.2	131	Application Data
2027	5.436010	192.168.178.64	35.210.58.154	TLSv1.3	129	Application Data
2024	5.435893	192.168.178.64	35.210.58.154	TLSv1.3	129	Application Data
2021	5.435756	192.168.178.64	35.210.58.154	TLSv1.3	129	Application Data
1883	5.387574	192.168.178.64	52.85.67.113	TLSv1.2	128	Application Data
3088	9.079088	192.168.178.64	54.77.230.99	TLSv1.3	118	Change Cipher Spec, Application Data
2435	6.410411	192.168.178.64	52.95.126.160	TLSv1.3	118	Change Cipher Spec, Application Data
2433	6.409428	192.168.178.64	52.95.126.160	TLSv1.3	118	Change Cipher Spec, Application Data
2011	5.434355	192.168.178.64	3.124.64.248	TLSv1.3	118	Change Cipher Spec, Application Data
1464	4.240661	192.168.178.64	63.140.62.27	TLSv1.3	118	Change Cipher Spec, Application Data
986	3.709850	192.168.178.64	63.140.62.17	TLSv1.3	118	Change Cipher Spec, Application Data
941	3.105616	192.168.178.64	52.219.72.215	TLSv1.3	118	Change Cipher Spec, Application Data
758	1.849020	192.168.178.64	141.95.33.120	TLSv1.3	118	Change Cipher Spec, Application Data
674	1.820574	192.168.178.64	52.219.72.215	TLSv1.3	118	Change Cipher Spec, Application Data
355	1.745939	192.168.178.64	52.85.67.113	TLSv1.3	118	Change Cipher Spec, Application Data
3893	11.732342	192.168.178.64	184.28.88.119	TLSv1.2	105	Change Cipher Spec, Encrypted Handshake Message
3347	10.150549	192.168.178.64	184.28.88.244	TLSv1.2	105	Change Cipher Spec, Encrypted Handshake Message
3951	14.025155	192.168.178.64	46.228.174.117	TLSv1.2	100	Application Data
2470	6.823090	192.168.178.64	37.252.171.85	TLSv1.2	96	Application Data
3846	11.637633	192.168.178.64	217.79.188.60	TLSv1.3	93	Application Data
3830	11.538271	192.168.178.64	217.79.188.60	TLSv1.3	93	Application Data
3769	11.383091	192.168.178.64	35.214.136.108	TLSv1.2	93	Application Data
3611	11.028901	192.168.178.64	35.214.136.108	TLSv1.2	93	Application Data
3539	10.988714	192.168.178.64	35.214.136.108	TLSv1.2	93	Application Data
3428	10.531468	192.168.178.64	35.214.136.108	TLSv1.2	93	Application Data
2762	7.863674	192.168.178.64	141.95.33.120	TLSv1.3	93	Application Data
3	0.559572	192.168.178.64	104.18.25.18	TLSv1.2	93	Application Data
3462	10.595826	192.168.178.64	46.228.174.117	TLSv1.2	92	Application Data
3357	10.163086	192.168.178.64	184.28.88.244	TLSv1.2	92	Application Data
2373	6.029229	192.168.178.64	34.254.143.3	TLSv1.2	92	Application Data
2080	5.455224	192.168.178.64	37.252.171.85	TLSv1.2	92	Application Data
3339	10.144467	192.168.178.64	104.18.25.18	TLSv1.2	89	Application Data
2282	5.621772	192.168.178.64	52.85.67.113	TLSv1.2	89	Application Data
2280	5.621274	192.168.178.64	52.85.67.113	TLSv1.2	89	Application Data
1892	5.388587	192.168.178.64	2.23.209.164	TLSv1.2	89	Application Data
1891	5.388371	192.168.178.64	52.85.67.113	TLSv1.2	89	Application Data
970	3.503296	192.168.178.64	52.85.65.72	TLSv1.2	89	Application Data
946	3.174840	192.168.178.64	52.85.65.72	TLSv1.2	89	Application Data
3952	14.025466	192.168.178.64	46.228.174.117	TLSv1.2	85	Encrypted Alert
3731	11.156909	192.168.178.64	185.235.86.81	TLSv1.3	85	Application Data
3726	11.154991	192.168.178.64	185.235.86.5	TLSv1.3	85	Application Data
3096	9.119967	192.168.178.64	54.77.230.99	TLSv1.3	85	Application Data
3081	9.046380	192.168.178.64	217.79.188.60	TLSv1.3	85	Application Data
3000	8.766379	192.168.178.64	217.79.188.60	TLSv1.3	85	Application Data
2395	6.152336	192.168.178.64	216.200.232.249	TLSv1.2	85	Encrypted Alert
2380	6.048359	192.168.178.64	34.254.143.3	TLSv1.2	85	Encrypted Alert
2095	5.456544	192.168.178.64	3.124.64.248	TLSv1.3	85	Application Data
1474	4.271495	192.168.178.64	63.140.62.27	TLSv1.3	85	Application Data
993	3.738173	192.168.178.64	63.140.62.17	TLSv1.3	85	Application Data
799	1.865320	192.168.178.64	141.95.33.120	TLSv1.3	85	Application Data
433	1.760822	192.168.178.64	52.85.67.113	TLSv1.3	85	Application Data
105	1.584967	192.168.178.64	2.23.209.144	TLSv1.3	85	Application Data
3847	11.637804	192.168.178.64	217.79.188.60	TLSv1.3	78	Application Data
3831	11.538412	192.168.178.64	217.79.188.60	TLSv1.3	78	Application Data
2946	8.599065	192.168.178.64	52.219.72.215	TLSv1.3	78	Application Data
2763	7.863872	192.168.178.64	141.95.33.120	TLSv1.3	78	Application Data
2720	7.597159	192.168.178.64	52.219.72.215	TLSv1.3	78	Application Data
3883	11.703739	192.168.178.64	184.28.88.119	TCP	66	59692 → 443 [SYN] Seq=0 Win=65535 Len=0 MSS=1460 WS=256 SACK_PERM
3665	11.076281	192.168.178.64	185.235.86.81	TCP	66	59691 → 443 [SYN] Seq=0 Win=65535 Len=0 MSS=1460 WS=256 SACK_PERM
3664	11.075531	192.168.178.64	185.235.86.5	TCP	66	59690 → 443 [SYN] Seq=0 Win=65535 Len=0 MSS=1460 WS=256 SACK_PERM
3634	11.048762	192.168.178.64	69.173.144.165	TCP	66	59689 → 443 [SYN] Seq=0 Win=65535 Len=0 MSS=1460 WS=256 SACK_PERM
3390	10.502151	192.168.178.64	46.228.174.117	TCP	66	59688 → 443 [SYN] Seq=0 Win=65535 Len=0 MSS=1460 WS=256 SACK_PERM
3310	10.122270	192.168.178.64	184.28.88.244	TCP	66	59687 → 443 [SYN] Seq=0 Win=65535 Len=0 MSS=1460 WS=256 SACK_PERM
3301	10.114918	192.168.178.64	23.213.161.14	TCP	66	59686 → 443 [SYN] Seq=0 Win=65535 Len=0 MSS=1460 WS=256 SACK_PERM
3299	10.114334	192.168.178.64	23.213.161.14	TCP	66	59685 → 443 [SYN] Seq=0 Win=65535 Len=0 MSS=1460 WS=256 SACK_PERM
3111	9.146616	192.168.178.64	136.243.25.87	TCP	66	59684 → 443 [SYN] Seq=0 Win=65535 Len=0 MSS=1460 WS=256 SACK_PERM
3110	9.146018	192.168.178.64	136.243.25.87	TCP	66	59683 → 443 [SYN] Seq=0 Win=65535 Len=0 MSS=1460 WS=256 SACK_PERM
3049	8.978349	192.168.178.64	54.77.230.99	TCP	66	59682 → 443 [SYN] Seq=0 Win=65535 Len=0 MSS=1460 WS=256 SACK_PERM
3044	8.970876	192.168.178.64	217.79.188.60	TCP	66	59681 → 443 [SYN] Seq=0 Win=65535 Len=0 MSS=1460 WS=256 SACK_PERM
3020	8.891247	192.168.178.64	217.79.188.60	TCP	66	59680 → 443 [SYN] Seq=0 Win=65535 Len=0 MSS=1460 WS=256 SACK_PERM
3018	8.846332	192.168.178.64	217.79.188.60	TCP	66	59679 → 443 [SYN] Seq=0 Win=65535 Len=0 MSS=1460 WS=256 SACK_PERM
2973	8.704345	192.168.178.64	217.79.188.60	TCP	66	59678 → 443 [SYN] Seq=0 Win=65535 Len=0 MSS=1460 WS=256 SACK_PERM
2415	6.322076	192.168.178.64	52.95.126.160	TCP	66	59674 → 443 [SYN] Seq=0 Win=65535 Len=0 MSS=1460 WS=256 SACK_PERM
2414	6.321628	192.168.178.64	52.95.126.160	TCP	66	59673 → 443 [SYN] Seq=0 Win=65535 Len=0 MSS=1460 WS=256 SACK_PERM
2317	5.857830	192.168.178.64	34.254.143.3	TCP	66	59672 → 443 [SYN] Seq=0 Win=65535 Len=0 MSS=1460 WS=256 SACK_PERM
2316	5.857608	192.168.178.64	34.254.143.3	TCP	66	59671 → 443 [SYN] Seq=0 Win=65535 Len=0 MSS=1460 WS=256 SACK_PERM
1879	5.382224	192.168.178.64	3.124.64.248	TCP	66	59670 → 443 [SYN] Seq=0 Win=65535 Len=0 MSS=1460 WS=256 SACK_PERM
1875	5.377746	192.168.178.64	37.252.171.85	TCP	66	59668 → 443 [SYN] Seq=0 Win=65535 Len=0 MSS=1460 WS=256 SACK_PERM
1872	5.371337	192.168.178.64	35.210.58.154	TCP	66	59667 → 443 [SYN] Seq=0 Win=65535 Len=0 MSS=1460 WS=256 SACK_PERM
1444	4.179616	192.168.178.64	63.140.62.27	TCP	66	59657 → 443 [SYN] Seq=0 Win=65535 Len=0 MSS=1460 WS=256 SACK_PERM
976	3.641759	192.168.178.64	63.140.62.17	TCP	66	59655 → 443 [SYN] Seq=0 Win=65535 Len=0 MSS=1460 WS=256 SACK_PERM
943	3.108366	192.168.178.64	52.219.72.215	TCP	66	[TCP Dup ACK 940#1] 59654 → 443 [ACK] Seq=1979 Ack=6137 Win=65024 Len=0 SLE=6079 SRE=6137
916	3.056060	192.168.178.64	52.219.72.215	TCP	66	59654 → 443 [SYN] Seq=0 Win=65535 Len=0 MSS=1460 WS=256 SACK_PERM
670	1.819220	192.168.178.64	52.219.72.215	TCP	66	59650 → 443 [ACK] Seq=1915 Ack=6137 Win=65280 Len=0 SLE=6079 SRE=6137
620	1.802989	192.168.178.64	141.95.33.120	TCP	66	59652 → 443 [SYN] Seq=0 Win=65535 Len=0 MSS=1460 WS=256 SACK_PERM
378	1.755442	192.168.178.64	52.219.72.215	TCP	66	59650 → 443 [SYN] Seq=0 Win=65535 Len=0 MSS=1460 WS=256 SACK_PERM
245	1.705219	192.168.178.64	52.85.67.113	TCP	66	59647 → 443 [SYN] Seq=0 Win=65535 Len=0 MSS=1460 WS=256 SACK_PERM
43	1.539391	192.168.178.64	2.23.209.144	TCP	66	59644 → 443 [SYN] Seq=0 Win=65535 Len=0 MSS=1460 WS=256 SACK_PERM
3708	11.105077	192.168.178.64	185.235.86.81	TLSv1.3	60	Change Cipher Spec
3705	11.103212	192.168.178.64	185.235.86.5	TLSv1.3	60	Change Cipher Spec
3736	11.233846	192.168.178.64	184.28.88.119	TCP	55	[TCP Keep-Alive] 59640 → 443 [ACK] Seq=1 Ack=1 Win=253 Len=1
3270	10.034150	192.168.178.64	69.173.144.138	TCP	55	[TCP Keep-Alive] 59530 → 443 [ACK] Seq=1 Ack=1 Win=255 Len=1
14	1.324390	192.168.178.64	69.173.144.165	TCP	55	59542 → 443 [ACK] Seq=1 Ack=1 Win=255 Len=1 [TCP PDU reassembled in 3630]
10	1.210975	192.168.178.64	184.28.88.119	TCP	55	59640 → 443 [ACK] Seq=1 Ack=1 Win=253 Len=1 [TCP PDU reassembled in 3882]
9	1.210958	192.168.178.64	184.28.88.119	TCP	55	59456 → 443 [ACK] Seq=1 Ack=1 Win=254 Len=1 [TCP PDU reassembled in 2070]
8	1.210832	192.168.178.64	184.28.88.119	TCP	55	59454 → 443 [ACK] Seq=1 Ack=1 Win=250 Len=1 [TCP PDU reassembled in 2039]
1	0.000000	192.168.178.64	69.173.144.138	TCP	55	59530 → 443 [ACK] Seq=1 Ack=1 Win=255 Len=1 [TCP PDU reassembled in 3534]
3955	14.025707	192.168.178.64	46.228.174.117	TCP	54	59688 → 443 [RST, ACK] Seq=2895 Ack=7232 Win=0 Len=0
3953	14.025504	192.168.178.64	46.228.174.117	TCP	54	59688 → 443 [FIN, ACK] Seq=2894 Ack=7201 Win=64256 Len=0
3919	11.885732	192.168.178.64	184.28.88.119	TCP	54	59640 → 443 [ACK] Seq=1288 Ack=429 Win=252 Len=0
3904	11.808200	192.168.178.64	184.28.88.119	TCP	54	59692 → 443 [ACK] Seq=3447 Ack=581 Win=64768 Len=0
3900	11.777283	192.168.178.64	184.28.88.119	TCP	54	59456 → 443 [ACK] Seq=7821 Ack=4004 Win=250 Len=0
3899	11.777223	192.168.178.64	184.28.88.119	TCP	54	59454 → 443 [ACK] Seq=9994 Ack=4561 Win=255 Len=0
3887	11.717507	192.168.178.64	184.28.88.119	TCP	54	59692 → 443 [ACK] Seq=1 Ack=1 Win=65280 Len=0
3885	11.714992	192.168.178.64	178.250.1.11	TCP	54	59519 → 443 [ACK] Seq=484 Ack=740 Win=252 Len=0
3872	11.661037	192.168.178.64	217.79.188.60	TCP	54	59681 → 443 [ACK] Seq=4597 Ack=6454 Win=65280 Len=0
3848	11.637836	192.168.178.64	217.79.188.60	TCP	54	59681 → 443 [FIN, ACK] Seq=4596 Ack=6453 Win=65280 Len=0
3845	11.637538	192.168.178.64	217.79.188.60	TCP	54	59681 → 443 [ACK] Seq=4533 Ack=6453 Win=65280 Len=0
3842	11.591149	192.168.178.64	37.252.171.85	TCP	54	59668 → 443 [ACK] Seq=50062 Ack=18082 Win=64411 Len=0
3832	11.538438	192.168.178.64	217.79.188.60	TCP	54	59678 → 443 [FIN, ACK] Seq=2727 Ack=5059 Win=64768 Len=0
3829	11.538186	192.168.178.64	217.79.188.60	TCP	54	59678 → 443 [ACK] Seq=2664 Ack=5059 Win=64768 Len=0
3789	11.451459	192.168.178.64	37.252.171.85	TCP	54	59668 → 443 [ACK] Seq=49335 Ack=17520 Win=64973 Len=0
3787	11.435529	192.168.178.64	184.28.88.119	TCP	54	59456 → 443 [ACK] Seq=6534 Ack=3576 Win=252 Len=0
3786	11.435510	192.168.178.64	184.28.88.119	TCP	54	59454 → 443 [ACK] Seq=7422 Ack=3705 Win=252 Len=0
3785	11.435457	192.168.178.64	37.157.2.14	TCP	54	59533 → 443 [ACK] Seq=1427 Ack=1743 Win=253 Len=0
3784	11.431441	192.168.178.64	69.173.144.165	TCP	54	59542 → 443 [ACK] Seq=2482 Ack=10713 Win=255 Len=0
3768	11.382472	192.168.178.64	35.214.136.108	TCP	54	59523 → 443 [ACK] Seq=3004 Ack=1899 Win=252 Len=0
3761	11.380018	192.168.178.64	37.252.171.85	TCP	54	59668 → 443 [ACK] Seq=48608 Ack=16958 Win=65535 Len=0
3756	11.368459	192.168.178.64	76.223.111.18	TCP	54	59507 → 443 [ACK] Seq=4158 Ack=3146 Win=255 Len=0
3740	11.265524	192.168.178.64	37.252.171.85	TCP	54	59668 → 443 [ACK] Seq=47719 Ack=14707 Win=65535 Len=0
3730	11.156802	192.168.178.64	185.235.86.81	TCP	54	59691 → 443 [ACK] Seq=2987 Ack=718 Win=64768 Len=0
3725	11.154820	192.168.178.64	185.235.86.5	TCP	54	59690 → 443 [ACK] Seq=2985 Ack=755 Win=64768 Len=0
3720	11.140830	192.168.178.64	69.173.144.165	TCP	54	59689 → 443 [ACK] Seq=2228 Ack=3126 Win=65280 Len=0
3710	11.125880	192.168.178.64	37.252.171.85	TCP	54	59668 → 443 [ACK] Seq=47005 Ack=13397 Win=64224 Len=0
3703	11.102756	192.168.178.64	185.235.86.81	TCP	54	59691 → 443 [ACK] Seq=1 Ack=1 Win=65280 Len=0
3699	11.101300	192.168.178.64	185.235.86.5	TCP	54	59690 → 443 [ACK] Seq=1 Ack=1 Win=65280 Len=0
3674	11.079644	192.168.178.64	185.184.8.90	TCP	54	59528 → 443 [ACK] Seq=1419 Ack=1570 Win=255 Len=0
3673	11.079633	192.168.178.64	46.228.174.117	TCP	54	59688 → 443 [ACK] Seq=2817 Ack=7155 Win=64256 Len=0
3672	11.079598	192.168.178.64	37.157.2.14	TCP	54	59533 → 443 [ACK] Seq=712 Ack=1222 Win=255 Len=0
3670	11.076694	192.168.178.64	69.173.144.165	TCP	54	59689 → 443 [ACK] Seq=1910 Ack=3075 Win=65280 Len=0
3662	11.070937	192.168.178.64	35.210.58.154	TCP	54	59667 → 443 [ACK] Seq=64312 Ack=23368 Win=65280 Len=0
3651	11.063066	192.168.178.64	184.28.88.119	TCP	54	59454 → 443 [ACK] Seq=6100 Ack=3277 Win=253 Len=0
3650	11.062677	192.168.178.64	69.173.144.165	TCP	54	59689 → 443 [ACK] Seq=1 Ack=1 Win=65280 Len=0
3648	11.061441	192.168.178.64	69.173.144.165	TCP	54	59542 → 443 [ACK] Seq=1242 Ack=5357 Win=255 Len=0
3633	11.048078	192.168.178.64	37.252.171.85	TCP	54	59668 → 443 [ACK] Seq=46258 Ack=12086 Win=65535 Len=0
3620	11.033077	192.168.178.64	178.250.7.13	TCP	54	59497 → 443 [ACK] Seq=195 Ack=771 Win=252 Len=0
3610	11.028455	192.168.178.64	35.214.136.108	TCP	54	59523 → 443 [ACK] Seq=2257 Ack=1724 Win=253 Len=0
3574	11.011617	192.168.178.64	76.223.111.18	TCP	54	59507 → 443 [ACK] Seq=2769 Ack=2963 Win=255 Len=0
3557	11.000454	192.168.178.64	69.173.144.138	TCP	54	59530 → 443 [ACK] Seq=1305 Ack=6375 Win=255 Len=0
3472	10.804353	192.168.178.64	52.50.128.177	TCP	54	59512 → 443 [ACK] Seq=1541 Ack=1349 Win=255 Len=0
3467	10.643089	192.168.178.64	46.228.174.117	TCP	54	59688 → 443 [ACK] Seq=2705 Ack=6934 Win=64512 Len=0
3466	10.627002	192.168.178.64	37.157.2.13	TCP	54	59537 → 443 [ACK] Seq=150 Ack=497 Win=253 Len=0
3465	10.626949	192.168.178.64	54.171.245.237	TCP	54	59536 → 443 [ACK] Seq=770 Ack=215 Win=253 Len=0
3458	10.581024	192.168.178.64	37.252.171.85	TCP	54	59668 → 443 [ACK] Seq=45422 Ack=10687 Win=64514 Len=0
3451	10.565783	192.168.178.64	185.184.8.90	TCP	54	59528 → 443 [ACK] Seq=708 Ack=1424 Win=255 Len=0
3442	10.546091	192.168.178.64	46.228.174.117	TCP	54	59688 → 443 [ACK] Seq=2073 Ack=6074 Win=65280 Len=0
3416	10.522958	192.168.178.64	46.228.174.117	TCP	54	59688 → 443 [ACK] Seq=1 Ack=1 Win=65280 Len=0
3364	10.486505	192.168.178.64	76.223.111.18	TCP	54	59507 → 443 [ACK] Seq=1393 Ack=1194 Win=250 Len=0
3361	10.222405	192.168.178.64	52.50.128.177	TCP	54	59512 → 443 [ACK] Seq=769 Ack=1107 Win=255 Len=0
3359	10.206413	192.168.178.64	23.213.161.14	TCP	54	59686 → 443 [ACK] Seq=2599 Ack=558 Win=64768 Len=0
3356	10.162963	192.168.178.64	184.28.88.244	TCP	54	59687 → 443 [ACK] Seq=2244 Ack=253 Win=65280 Len=0
3337	10.140691	192.168.178.64	184.28.88.119	TCP	54	59456 → 443 [ACK] Seq=3898 Ack=2720 Win=255 Len=0
3333	10.136483	192.168.178.64	184.28.88.244	TCP	54	59687 → 443 [ACK] Seq=1 Ack=1 Win=65280 Len=0
3324	10.130906	192.168.178.64	23.213.161.14	TCP	54	59686 → 443 [ACK] Seq=1 Ack=1 Win=65280 Len=0
3318	10.128741	192.168.178.64	184.28.88.119	TCP	54	59454 → 443 [ACK] Seq=3902 Ack=2720 Win=255 Len=0
3249	9.894065	192.168.178.64	76.223.111.18	TCP	54	59507 → 443 [ACK] Seq=695 Ack=1078 Win=250 Len=0
3242	9.881033	192.168.178.64	63.140.62.17	TCP	54	59655 → 443 [ACK] Seq=31671 Ack=15853 Win=65280 Len=0
3180	9.558939	192.168.178.64	54.77.230.99	TCP	54	59682 → 443 [ACK] Seq=3735 Ack=21058 Win=64000 Len=0
3147	9.266738	192.168.178.64	136.243.25.87	TCP	54	59683 → 443 [ACK] Seq=3902 Ack=4344 Win=64256 Len=0
3146	9.220503	192.168.178.64	54.77.230.99	TCP	54	59682 → 443 [ACK] Seq=2891 Ack=20837 Win=64256 Len=0
3144	9.207954	192.168.178.64	136.243.25.87	TCP	54	59684 → 443 [ACK] Seq=2595 Ack=3703 Win=64768 Len=0
3141	9.206998	192.168.178.64	136.243.25.87	TCP	54	59683 → 443 [ACK] Seq=3902 Ack=3703 Win=64768 Len=0
3135	9.190153	192.168.178.64	136.243.25.87	TCP	54	59684 → 443 [ACK] Seq=2515 Ack=3129 Win=65280 Len=0
3129	9.188108	192.168.178.64	136.243.25.87	TCP	54	59683 → 443 [ACK] Seq=2515 Ack=3129 Win=65280 Len=0
3122	9.171191	192.168.178.64	136.243.25.87	TCP	54	59684 → 443 [ACK] Seq=1 Ack=1 Win=65280 Len=0
3118	9.165308	192.168.178.64	136.243.25.87	TCP	54	59683 → 443 [ACK] Seq=1 Ack=1 Win=65280 Len=0
3116	9.159035	192.168.178.64	54.77.230.99	TCP	54	59682 → 443 [ACK] Seq=2891 Ack=19616 Win=65280 Len=0
3109	9.127327	192.168.178.64	54.77.230.99	TCP	54	59682 → 443 [ACK] Seq=2891 Ack=13808 Win=65280 Len=0
3104	9.126060	192.168.178.64	54.77.230.99	TCP	54	59682 → 443 [ACK] Seq=2891 Ack=8000 Win=65280 Len=0
3095	9.119062	192.168.178.64	54.77.230.99	TCP	54	59682 → 443 [ACK] Seq=2860 Ack=4975 Win=65280 Len=0
3087	9.075303	192.168.178.64	54.77.230.99	TCP	54	59682 → 443 [ACK] Seq=2284 Ack=4734 Win=65280 Len=0
3079	9.045144	192.168.178.64	217.79.188.60	TCP	54	59681 → 443 [ACK] Seq=4502 Ack=4974 Win=64768 Len=0
3070	9.019989	192.168.178.64	217.79.188.60	TCP	54	59681 → 443 [ACK] Seq=1906 Ack=4412 Win=65280 Len=0
3069	9.019961	192.168.178.64	54.77.230.99	TCP	54	59682 → 443 [ACK] Seq=1 Ack=1 Win=65280 Len=0
3056	8.994099	192.168.178.64	217.79.188.60	TCP	54	59681 → 443 [ACK] Seq=1 Ack=1 Win=65280 Len=0
3042	8.966765	192.168.178.64	217.79.188.60	TCP	54	59680 → 443 [ACK] Seq=2462 Ack=4413 Win=65280 Len=0
3036	8.942520	192.168.178.64	217.79.188.60	TCP	54	59680 → 443 [FIN, ACK] Seq=2461 Ack=4412 Win=65280 Len=0
3035	8.940858	192.168.178.64	217.79.188.60	TCP	54	59680 → 443 [ACK] Seq=2461 Ack=4412 Win=65280 Len=0
3026	8.915516	192.168.178.64	217.79.188.60	TCP	54	59680 → 443 [ACK] Seq=1 Ack=1 Win=65280 Len=0
3017	8.841842	192.168.178.64	63.140.62.17	TCP	54	59655 → 443 [ACK] Seq=24631 Ack=15114 Win=64256 Len=0
2999	8.765372	192.168.178.64	217.79.188.60	TCP	54	59678 → 443 [ACK] Seq=2633 Ack=4996 Win=64768 Len=0
2992	8.746047	192.168.178.64	217.79.188.60	TCP	54	59678 → 443 [ACK] Seq=2461 Ack=4412 Win=65280 Len=0
2985	8.732041	192.168.178.64	217.79.188.54	TCP	54	59522 → 443 [ACK] Seq=1305 Ack=3345 Win=255 Len=0
2980	8.722167	192.168.178.64	217.79.188.60	TCP	54	59678 → 443 [ACK] Seq=1 Ack=1 Win=65280 Len=0
2953	8.615282	192.168.178.64	52.219.72.215	TCP	54	59654 → 443 [RST, ACK] Seq=2004 Ack=6161 Win=0 Len=0
2947	8.599105	192.168.178.64	52.219.72.215	TCP	54	59654 → 443 [FIN, ACK] Seq=2003 Ack=6137 Win=65024 Len=0
2764	7.863909	192.168.178.64	141.95.33.120	TCP	54	59652 → 443 [FIN, ACK] Seq=2148 Ack=2678 Win=65024 Len=0
2761	7.863531	192.168.178.64	141.95.33.120	TCP	54	59652 → 443 [ACK] Seq=2085 Ack=2678 Win=65024 Len=0
2737	7.625396	192.168.178.64	3.124.64.248	TCP	54	[TCP Keep-Alive ACK] 59670 → 443 [ACK] Seq=9979 Ack=5139 Win=64256 Len=0
2733	7.614723	192.168.178.64	52.219.72.215	TCP	54	59650 → 443 [RST, ACK] Seq=2004 Ack=6161 Win=0 Len=0
2721	7.597191	192.168.178.64	52.219.72.215	TCP	54	59650 → 443 [FIN, ACK] Seq=2003 Ack=6137 Win=65280 Len=0
2448	6.563811	192.168.178.64	52.95.126.160	TCP	54	59674 → 443 [ACK] Seq=3489 Ack=954 Win=64512 Len=0
2444	6.501278	192.168.178.64	37.252.171.85	TCP	54	59668 → 443 [ACK] Seq=44521 Ack=8277 Win=64277 Len=0
2441	6.454395	192.168.178.64	52.95.126.160	TCP	54	59673 → 443 [ACK] Seq=3483 Ack=1885 Win=65280 Len=0
2426	6.376225	192.168.178.64	37.252.171.85	TCP	54	59668 → 443 [ACK] Seq=44521 Ack=7019 Win=65535 Len=0
2423	6.362880	192.168.178.64	52.95.126.160	TCP	54	59674 → 443 [ACK] Seq=1 Ack=1 Win=65280 Len=0
2421	6.361742	192.168.178.64	52.95.126.160	TCP	54	59673 → 443 [ACK] Seq=1 Ack=1 Win=65280 Len=0
2406	6.280392	192.168.178.64	108.138.38.29	TCP	54	59472 → 443 [ACK] Seq=1789 Ack=983 Win=252 Len=0
2401	6.245186	192.168.178.64	2.23.209.164	TCP	54	59437 → 443 [ACK] Seq=1447 Ack=3197 Win=509 Len=0
2398	6.236435	192.168.178.64	37.252.171.85	TCP	54	59668 → 443 [ACK] Seq=44521 Ack=5832 Win=64187 Len=0
2396	6.152389	192.168.178.64	216.200.232.249	TCP	54	59429 → 443 [FIN, ACK] Seq=32 Ack=33 Win=251 Len=0
2394	6.152111	192.168.178.64	216.200.232.249	TCP	54	59429 → 443 [ACK] Seq=1 Ack=33 Win=251 Len=0
2389	6.127134	192.168.178.64	37.252.171.85	TCP	54	59668 → 443 [ACK] Seq=44521 Ack=4484 Win=65535 Len=0
2383	6.081269	192.168.178.64	34.254.143.3	TCP	54	59671 → 443 [ACK] Seq=2756 Ack=4593 Win=65024 Len=0
2381	6.048392	192.168.178.64	34.254.143.3	TCP	54	59672 → 443 [FIN, ACK] Seq=2178 Ack=4241 Win=65280 Len=0
2379	6.048110	192.168.178.64	34.254.143.3	TCP	54	59672 → 443 [ACK] Seq=2147 Ack=4241 Win=65280 Len=0
2362	5.959546	192.168.178.64	18.159.188.190	TCP	54	59464 → 443 [ACK] Seq=2346 Ack=181 Win=252 Len=0
2353	5.949583	192.168.178.64	34.254.143.3	TCP	54	59672 → 443 [ACK] Seq=1905 Ack=4136 Win=65280 Len=0
2347	5.947960	192.168.178.64	34.254.143.3	TCP	54	59671 → 443 [ACK] Seq=1905 Ack=4136 Win=65280 Len=0
2335	5.926118	192.168.178.64	37.252.171.85	TCP	54	59668 → 443 [ACK] Seq=44521 Ack=3228 Win=64973 Len=0
2331	5.899242	192.168.178.64	34.254.143.3	TCP	54	59672 → 443 [ACK] Seq=1 Ack=1 Win=65280 Len=0
2329	5.898320	192.168.178.64	34.254.143.3	TCP	54	59671 → 443 [ACK] Seq=1 Ack=1 Win=65280 Len=0
2307	5.803528	192.168.178.64	34.242.52.142	TCP	54	59441 → 443 [ACK] Seq=1590 Ack=3751 Win=255 Len=0
2287	5.674268	192.168.178.64	184.28.88.119	TCP	54	59456 → 443 [ACK] Seq=2573 Ack=864 Win=250 Len=0
2286	5.674207	192.168.178.64	3.124.64.248	TCP	54	59670 → 443 [ACK] Seq=9979 Ack=5139 Win=64256 Len=0
2278	5.594572	192.168.178.64	37.252.171.85	TCP	54	59668 → 443 [ACK] Seq=44521 Ack=3186 Win=65015 Len=0
2277	5.579586	192.168.178.64	184.28.88.119	TCP	54	59454 → 443 [ACK] Seq=2577 Ack=864 Win=255 Len=0
2274	5.563562	192.168.178.64	37.157.6.237	TCP	54	59462 → 443 [ACK] Seq=8734 Ack=588 Win=255 Len=0
2273	5.562329	192.168.178.64	35.210.58.154	TCP	54	59667 → 443 [ACK] Seq=62829 Ack=21506 Win=65280 Len=0
2269	5.559978	192.168.178.64	35.210.58.154	TCP	54	59667 → 443 [ACK] Seq=62829 Ack=19748 Win=65280 Len=0
2262	5.552444	192.168.178.64	35.210.58.154	TCP	54	59667 → 443 [ACK] Seq=62829 Ack=17963 Win=65280 Len=0
2259	5.549074	192.168.178.64	35.210.58.154	TCP	54	59667 → 443 [ACK] Seq=62829 Ack=16243 Win=65280 Len=0
2254	5.543663	192.168.178.64	35.210.58.154	TCP	54	59667 → 443 [ACK] Seq=62829 Ack=14486 Win=65280 Len=0
2242	5.528505	192.168.178.64	35.210.58.154	TCP	54	59667 → 443 [ACK] Seq=62829 Ack=12732 Win=65280 Len=0
2224	5.521642	192.168.178.64	35.210.58.154	TCP	54	59667 → 443 [ACK] Seq=62829 Ack=10942 Win=65280 Len=0
2220	5.520183	192.168.178.64	35.210.58.154	TCP	54	59667 → 443 [ACK] Seq=62829 Ack=9187 Win=65280 Len=0
2216	5.515991	192.168.178.64	185.64.189.112	TCP	54	59455 → 443 [ACK] Seq=10187 Ack=79 Win=254 Len=0
2215	5.515952	192.168.178.64	3.124.64.248	TCP	54	59670 → 443 [ACK] Seq=9979 Ack=4450 Win=65024 Len=0
2214	5.515581	192.168.178.64	35.210.58.154	TCP	54	59667 → 443 [ACK] Seq=62829 Ack=9152 Win=65280 Len=0
2202	5.509199	192.168.178.64	95.101.149.35	TCP	54	59444 → 443 [ACK] Seq=2700 Ack=680 Win=250 Len=0
2194	5.506960	192.168.178.64	35.210.58.154	TCP	54	59667 → 443 [ACK] Seq=62829 Ack=7398 Win=65280 Len=0
2193	5.506933	192.168.178.64	34.254.237.109	TCP	54	59447 → 443 [ACK] Seq=2186 Ack=1797 Win=255 Len=0
2186	5.500695	192.168.178.64	35.210.58.154	TCP	54	59667 → 443 [ACK] Seq=62829 Ack=5644 Win=65280 Len=0
2074	5.453707	192.168.178.64	35.210.58.154	TCP	54	59667 → 443 [ACK] Seq=17786 Ack=3405 Win=65280 Len=0
2060	5.451216	192.168.178.64	37.252.171.85	TCP	54	59668 → 443 [ACK] Seq=2199 Ack=3009 Win=65192 Len=0
2057	5.450167	192.168.178.64	35.210.58.154	TCP	54	59667 → 443 [ACK] Seq=17786 Ack=3374 Win=65280 Len=0
2030	5.438890	192.168.178.64	37.157.6.237	TCP	54	59462 → 443 [ACK] Seq=8734 Ack=36 Win=251 Len=0
2005	5.428651	192.168.178.64	37.252.171.85	TCP	54	59668 → 443 [ACK] Seq=2106 Ack=2666 Win=65535 Len=0
2000	5.427532	192.168.178.64	3.124.64.248	TCP	54	59670 → 443 [ACK] Seq=1899 Ack=4338 Win=65024 Len=0
1995	5.427008	192.168.178.64	35.210.58.154	TCP	54	59667 → 443 [ACK] Seq=1902 Ack=3154 Win=65280 Len=0
1994	5.426989	192.168.178.64	3.124.64.248	TCP	54	59670 → 443 [ACK] Seq=1899 Ack=3994 Win=65280 Len=0
1925	5.404687	192.168.178.64	3.124.64.248	TCP	54	59670 → 443 [ACK] Seq=1 Ack=1 Win=65280 Len=0
1923	5.403842	192.168.178.64	37.252.171.85	TCP	54	59668 → 443 [ACK] Seq=1 Ack=1 Win=65535 Len=0
1899	5.393797	192.168.178.64	35.210.58.154	TCP	54	59667 → 443 [ACK] Seq=1 Ack=1 Win=65280 Len=0
1860	5.238642	192.168.178.64	63.140.62.27	TCP	54	59657 → 443 [ACK] Seq=13331 Ack=5450 Win=64768 Len=0
1688	4.709309	192.168.178.64	2.23.209.164	TCP	54	59437 → 443 [ACK] Seq=108 Ack=2440 Win=511 Len=0
1637	4.652618	192.168.178.64	63.35.45.179	TCP	54	59475 → 443 [ACK] Seq=182 Ack=1274 Win=255 Len=0
1621	4.646525	192.168.178.64	34.242.52.142	TCP	54	59441 → 443 [ACK] Seq=89 Ack=1094 Win=251 Len=0
1491	4.305610	192.168.178.64	63.140.62.27	TCP	54	59657 → 443 [ACK] Seq=9516 Ack=4934 Win=65280 Len=0
1482	4.297464	192.168.178.64	63.140.62.27	TCP	54	59657 → 443 [ACK] Seq=9516 Ack=4411 Win=64000 Len=0
1463	4.238186	192.168.178.64	63.140.62.27	TCP	54	59657 → 443 [ACK] Seq=1906 Ack=3105 Win=65280 Len=0
1451	4.208672	192.168.178.64	63.140.62.27	TCP	54	59657 → 443 [ACK] Seq=1 Ack=1 Win=65280 Len=0
1252	4.000149	192.168.178.64	63.140.62.17	TCP	54	59655 → 443 [ACK] Seq=17587 Ack=14377 Win=64768 Len=0
1003	3.776159	192.168.178.64	63.140.62.17	TCP	54	59655 → 443 [ACK] Seq=9228 Ack=13856 Win=65280 Len=0
985	3.707616	192.168.178.64	63.140.62.17	TCP	54	59655 → 443 [ACK] Seq=1901 Ack=3140 Win=65280 Len=0
978	3.674537	192.168.178.64	63.140.62.17	TCP	54	59655 → 443 [ACK] Seq=1 Ack=1 Win=65280 Len=0
955	3.251287	192.168.178.64	52.85.65.72	TCP	54	59382 → 443 [ACK] Seq=2400 Ack=636 Win=1018 Len=0
940	3.104066	192.168.178.64	52.219.72.215	TCP	54	59654 → 443 [ACK] Seq=1915 Ack=6137 Win=65024 Len=0
937	3.102449	192.168.178.64	52.219.72.215	TCP	54	59654 → 443 [ACK] Seq=1915 Ack=5793 Win=65280 Len=0
926	3.084020	192.168.178.64	52.219.72.215	TCP	54	59654 → 443 [ACK] Seq=1 Ack=1 Win=65280 Len=0
797	1.863859	192.168.178.64	141.95.33.120	TCP	54	59652 → 443 [ACK] Seq=2054 Ack=2556 Win=65280 Len=0
748	1.845430	192.168.178.64	141.95.33.120	TCP	54	59652 → 443 [ACK] Seq=1898 Ack=2398 Win=65280 Len=0
677	1.820873	192.168.178.64	141.95.33.120	TCP	54	59652 → 443 [ACK] Seq=1 Ack=1 Win=65280 Len=0
651	1.813720	192.168.178.64	52.219.72.215	TCP	54	59650 → 443 [ACK] Seq=1915 Ack=6079 Win=65280 Len=0
645	1.812881	192.168.178.64	52.219.72.215	TCP	54	59650 → 443 [ACK] Seq=1915 Ack=1646 Win=65280 Len=0
592	1.786977	192.168.178.64	128.65.210.185	TCP	54	59376 → 443 [ACK] Seq=681 Ack=236020 Win=1021 Len=0
580	1.785880	192.168.178.64	128.65.210.185	TCP	54	59376 → 443 [ACK] Seq=681 Ack=235342 Win=1023 Len=0
554	1.775897	192.168.178.64	52.219.72.215	TCP	54	59650 → 443 [ACK] Seq=1 Ack=1 Win=65280 Len=0
549	1.774617	192.168.178.64	128.65.210.185	TCP	54	59376 → 443 [ACK] Seq=681 Ack=216466 Win=1023 Len=0
540	1.774443	192.168.178.64	128.65.210.185	TCP	54	59376 → 443 [ACK] Seq=681 Ack=206302 Win=1023 Len=0
504	1.772741	192.168.178.64	128.65.210.185	TCP	54	59376 → 443 [ACK] Seq=681 Ack=159838 Win=1023 Len=0
494	1.771886	192.168.178.64	128.65.210.185	TCP	54	59376 → 443 [ACK] Seq=681 Ack=146770 Win=1023 Len=0
469	1.771008	192.168.178.64	128.65.210.185	TCP	54	59376 → 443 [ACK] Seq=681 Ack=120634 Win=1023 Len=0
432	1.760060	192.168.178.64	52.85.67.113	TCP	54	59647 → 443 [ACK] Seq=2063 Ack=5108 Win=64512 Len=0
427	1.759367	192.168.178.64	128.65.210.185	TCP	54	59376 → 443 [ACK] Seq=681 Ack=100306 Win=1023 Len=0
419	1.758255	192.168.178.64	128.65.210.185	TCP	54	59376 → 443 [ACK] Seq=681 Ack=91594 Win=1023 Len=0
414	1.756926	192.168.178.64	128.65.210.185	TCP	54	59376 → 443 [ACK] Seq=681 Ack=87238 Win=1023 Len=0
397	1.756181	192.168.178.64	128.65.210.185	TCP	54	59376 → 443 [ACK] Seq=681 Ack=65458 Win=1023 Len=0
390	1.755692	192.168.178.64	128.65.210.185	TCP	54	59376 → 443 [ACK] Seq=681 Ack=56746 Win=1023 Len=0
346	1.742827	192.168.178.64	128.65.210.185	TCP	54	59376 → 443 [ACK] Seq=681 Ack=42226 Win=1023 Len=0
335	1.740985	192.168.178.64	52.85.67.113	TCP	54	59647 → 443 [ACK] Seq=1907 Ack=4836 Win=64768 Len=0
334	1.740966	192.168.178.64	128.65.210.185	TCP	54	59376 → 443 [ACK] Seq=681 Ack=39322 Win=1023 Len=0
317	1.739714	192.168.178.64	128.65.210.185	TCP	54	59376 → 443 [ACK] Seq=681 Ack=20446 Win=1023 Len=0
307	1.738643	192.168.178.64	52.85.67.113	TCP	54	59647 → 443 [ACK] Seq=1907 Ack=4321 Win=65280 Len=0
281	1.726561	192.168.178.64	128.65.210.185	TCP	54	59376 → 443 [ACK] Seq=681 Ack=13186 Win=1023 Len=0
275	1.725812	192.168.178.64	128.65.210.185	TCP	54	59376 → 443 [ACK] Seq=681 Ack=10672 Win=1023 Len=0
267	1.723908	192.168.178.64	128.65.210.185	TCP	54	59376 → 443 [ACK] Seq=681 Ack=5254 Win=1023 Len=0
260	1.722760	192.168.178.64	52.85.67.113	TCP	54	59647 → 443 [ACK] Seq=1 Ack=1 Win=65280 Len=0
104	1.584098	192.168.178.64	2.23.209.144	TCP	54	59644 → 443 [ACK] Seq=2697 Ack=644 Win=64768 Len=0
59	1.554867	192.168.178.64	2.23.209.144	TCP	54	59644 → 443 [ACK] Seq=1 Ack=1 Win=65280 Len=0
5	0.638539	192.168.178.64	104.18.25.18	TCP	54	59509 → 443 [ACK] Seq=40 Ack=40 Win=254 Len=0